,Link,Ranking,about,category,email,facebook page,facebook subscribers,instagram Url,name
0,http://beefriendlyskincare.com,"335,901",BeeFriendly Skincare Certified Organic and Handmade by Holistic BeeKeepers in Hawaii as seen at http://BeeFriendlySkincare.com,Skin Care Service,[help@beefriendlyskincare.com],https://www.facebook.com/beefriendlyskincare/,14514,https://www.instagram.com/beefriendlyskincare,BeeFriendly Skin Care
1,fidget360.com,"336,904","as many people's hands who struggle with attention disorders. We all personally know the struggle of experimenting with medicine, and not being able to foc",Games/Toys,[support@fidget360.com],https://www.facebook.com/fidget360/,607,https://www.instagram.com/fidget360,Fidget360
2,http://www.sthsweet.com,"337,638","somethin' sweet, Korean fashion to your taste.",Clothing (Brand),,https://www.facebook.com/sthsweet/,18,https://www.instagram.com/sthsweet,Somethin' Sweet
3,http://www.Blade-City.com,"337,793","The Ultimate Knife Store

This is our only page. All others are store affiliates.",Website,[support@blade-city.com],https://www.facebook.com/Blade.city/,872328,https://www.instagram.com/blade-city,Blade City
4,http://www.wandererbracelets.com,"337,806",Hand carved in a hut in Bali. Support jobs for village artisans. Fight Ivory Trade- Carved from Sustainable water buffalo bone.,Jewelry/Watches,[info@wandererbracelets.com],https://www.facebook.com/wandererbracelets/,332682,https://www.instagram.com/wandererbracelets,Wanderer Bracelets
5,https://www.bourbonandboots.com,"337,827",Bourbon & Boots is a Southern Lifestyle Brand producing rare & unique handcrafted products celebrating life in the South. ,Accessories,[customerservice@bourbonandboots.com],https://www.facebook.com/bourbonandboots/,395255,https://www.instagram.com/bourbonandboots,Bourbon & Boots
6,http://www.bottlecutting.com,"338,530",The Do It Yourself Glassware Company ,Product/Service,,https://www.facebook.com/bottlecutting/,212392,https://www.instagram.com/bottlecutting,Bottle Cutting Inc.
7,www.luminaid.com ,"338,780","Makers of brilliant things. Give Light, Get Light and join us in our mission to make the world a brighter place.  As seen on ABC's Shark Tank. luminaid.com",Product/Service,,https://www.facebook.com/LuminAID/,21603,https://www.instagram.com/luminaid,LuminAID
8,http://www.mobicity.com.br,"338,821","A Mobicity conecta colaboradores em organizações por suas afinidades e localizações, oferecendo aos gestores um mapa modal e gráficos para decisões de mobi",Computer Company,[contato@mobi-city.net],https://www.facebook.com/Mobicity/,999,https://www.instagram.com/mobicity,Mobicity
9,https://www.mygearglobal.com,"339,165","Thanks for checking us out!  To get updates on the amazing deals we offer, LIKE US!",Website,,https://www.facebook.com/mygearglobal/,352,https://www.instagram.com/mygearglobal,My Gear Global
10,http://www.dukeanddexter.com,"340,168","Designed in London | Handmade in England

Premium loafers that combine British heritage with global inspiration",Clothing (Brand),[info@dukeanddexter.com],https://www.facebook.com/dukeanddexter/,72681,https://www.instagram.com/dukeanddexter,Duke & Dexter
11,http://www.sparkswarehouse.com,"340,352",At Sparks Warehouse you can order online or speak to one of our highly experienced wholesale buying team to find any product you need and at the best price,Company,[info@sparkswarehouse.com],https://www.facebook.com/sparkswarehouse/,744,https://www.instagram.com/sparkswarehouse,Sparks Warehouse
12,http://www.manduapparel.com,"340,378",Mandu Apparel offers unique KPOP clothing and accessories to KPOP fans all over the world. ,Clothing (Brand),,https://www.facebook.com/manduapparel/,2121,https://www.instagram.com/manduapparel,Mandu Apparel
13,https://www.costbuys.com/,"340,381",Shopping for general goods and merchandise at discounted prices.,Brand,,https://www.facebook.com/costbuys/,697,https://www.instagram.com/costbuys,Costbuys
14,,"340,509","Specialise in making gifts for all occasions!!

Any requests are welcome and i will try my best to recreate all",Arts & Crafts Store,[laurawalker_12@hotmail.co.uk],https://www.facebook.com/laurasboutique/,632,https://www.instagram.com/lauras-boutique,Laura's Boutique
15,http://riverbabethreads.com,"341,419","Hip apparel & accessories for modern moms and trendy kids. Based in Grand Rapids, Michigan.",Shopping & Retail,[hello@riverbabethreads.com],https://www.facebook.com/riverbabethreads/,95764,https://www.instagram.com/riverbabethreads,River Babe Threads
16,http://www.blenderseyewear.com,"342,099",Website –> www.BlendersEyewear.com,Retail Company,[support@blenderseyewear.com],https://www.facebook.com/BlendersEyewear/,357817,https://www.instagram.com/blenderseyewear,Blenders Eyewear
17,http://www.occmakeup.com/,"342,104",100% VEGAN & CRUELTY-FREE,Health/Beauty,[info@occmakeup.com],https://www.facebook.com/occmakeup/,143613,https://www.instagram.com/occmakeup,Obsessive Compulsive Cosmetics
18,www.playfulpromises.com,"342,191","www.playfulpromises.com Playful Promises is a London-designed lingerie brand which mixes quirky, directional design with all things playful, flirty, and even a little bit dirty. ",Shopping & Retail,[customerservices@playfulpromises.com],https://www.facebook.com/PlayfulPromises/,74196,https://www.instagram.com/playfulpromises,Playful Promises
19,http://www.beckettsimonon.com,"343,884",Handcrafted footwear and leather goods. Free Shipping & Returns http://www.beckettsimonon.com,Clothing (Brand),,https://www.facebook.com/BeckettSimonon/,21462,https://www.instagram.com/beckettsimonon,Beckett Simonon
20,http://www.onceuponatee.net,"346,269",Once Upon a Tee features New and Exclusive $12 T-Shirts every Monday at 11AM PST inspired by all of your favorite fandoms.,Clothing (Brand),,https://www.facebook.com/OnceUponATee/,294747,https://www.instagram.com/onceuponatee,Once Upon a Tee
21,http://www.tha-alumni.com/,"346,393","Alumni Clothing http://www.tha-alumni.com/

Verse Simmonds ""To All The Girls"" LP http://bit.ly/ToAllTheGirls

Kid Ink - ""Up & Away"" LP http://bit.ly/UpAn

",Musician/Band,,https://www.facebook.com/ThaAlumni/,293162,https://www.instagram.com/tha-alumni,Tha Alumni Music Group
22,https://www.gmyle.com,"347,071",GMYLE - Take care of your case since 2005,Product/Service,[support@gmyle.com],https://www.facebook.com/GMYLE/,74170,https://www.instagram.com/gmyle,GMYLE
23,http://www.gearrup.com,"347,242",We specialize in offering unique niche products that can't normally be found in retail stores.  ,Website,,https://www.facebook.com/gearrup/,19325,https://www.instagram.com/gearrup,GearrUp
24,,"347,508","Hi, this page provides to you best Karma videos all in one place. Have fun ;) 

But remember, karma is a bad b1tch��",Performing Arts,,https://www.facebook.com/Rektarmy/,34,https://www.instagram.com/rektarmy,ReKtarma
25,http://www.planetsuperheroes.com,"347,999", www.planetsuperheroes.com Planet Superheroes is India's first and only online store for Superheroes & Comic Character Merchandise. ,Retail Company,[care@planetsuperheroes.com],https://www.facebook.com/planetsuperheroes/,244078,https://www.instagram.com/planetsuperheroes,Planet Superheroes
26,www.reasonclothing.com www.twitter.com/reasonclothing www.instagram.com/reasonclothing,"349,086","Visit the Reason Outpost NYC at 436 East 9th Street, New York, NY 10009. Open Daily 12-8 or shop online at http://www.reasonclothing.com  Now open our Reason Southampton Outpost 25 Hampton Road Southampton, NY!",Clothing Store,[info@reasonclothing.com],https://www.facebook.com/reasonclothing/,39404,https://www.instagram.com/reasonclothing,REASON CLOTHING
27,http://www.sportique.com,"349,319",US,Sports & Recreation,[connect@sportique.com],https://www.facebook.com/Sportique/,9209,https://www.instagram.com/sportique,Sportique
28,http://www.standardsmanual.com,"350,789",Standards Manual is a New York City based independent publishing imprint founded by designers Jesse Reed and Hamish Smyth in 2014.,Bookstore,[contact@standardsmanual.com],https://www.facebook.com/standardsmanual/,13510,https://www.instagram.com/standardsmanual,Standards Manual
29,www.chilitechnology.com,"350,922",Follow our blog! http://blog.chilitechnology.com,Mattress Store,[help@chilitechnology.com],https://www.facebook.com/ChiliTechnology/,14307,https://www.instagram.com/chilitechnology,ChiliPad
30,http://www.kawaiipenshop.com,"351,618","We are full of super cute and unique stationery sure to satisfy all stationery addicts.

FREE international shipping on all items.",Office Supplies,[info@kawaiipenshop.com],https://www.facebook.com/kawaiipenshop/,116522,https://www.instagram.com/kawaiipenshop,Kawaii Pen Shop
31,http://www.mymakeupbrushset.com,"351,729","We specialize in providing high quality Makeup Brushes focusing on longevity, flawless application and durability",Health/Beauty,,https://www.facebook.com/mymakeupbrushset/,592449,https://www.instagram.com/mymakeupbrushset,My Makeup Brush Set
32,http://www.goldieblox.com/,"351,965",Empowering girls to be leaders in STEM with smart toys and awesome content!,Games/Toys,[info@goldieblox.com],https://www.facebook.com/GoldieBlox/,235983,https://www.instagram.com/goldieblox,GoldieBlox
33,https://www.LeggingSuperstore.com,"353,267",,Shopping & Retail,,https://www.facebook.com/LeggingSuperstore/,802,https://www.instagram.com/leggingsuperstore,Legging Superstore
34,https://printgaze.com/,"353,608",Print Gaze has revolutionized the way that artwork and stylish home decor unite. Designs for all our beloved peeps out there - represent your flare with ou,Website,,https://www.facebook.com/printgaze/,51270,https://www.instagram.com/printgaze,Print Gaze
35,http://www.heromart.com/,"354,214",Rare Items for the Real World! www.HeroMart.com is open 24 hours a day 7 days a week. We are considering altering time and space so it can be open more.,Shopping Mall,[heromart@battleon.com],https://www.facebook.com/HeroMart/,12955,https://www.instagram.com/heromart,HeroMart
36,https://oznaturalsblog.wordpress.com/,"354,416","This Page is NOT to promote our products but to educate on health . . . we are far too often exposed to harmful chemicals . . . we need to STOP poisoning ourselves, our children and our planet!",Product/Service,,https://www.facebook.com/OzNaturals/,684,https://www.instagram.com/oznaturals,Oz Naturals
37,http://Daisyjing.com,"354,975",Daisy Jing apparel line,Health/Beauty,[daisy@yourperfectbeauty.com],https://www.facebook.com/banishacnescars/,3904,https://www.instagram.com/banishacnescars,Daiserz89
38,http://www.brydgekeyboards.com ,"355,673",We create premium detachable & desktop accessories that are beautifully designed & simple to use. Available for iPad and Surface Pro. #GoDoMore,Electronics,[support@brydgekeyboards.com],https://www.facebook.com/brydgekeyboards/,60262,https://www.instagram.com/brydgekeyboards,Brydge Keyboards
39,"http://www.solidandstriped.com, http://www.twitter.com/solidandstriped, http://instagram.com/solidandstriped, http://www.pinterest.com/solidandstriped/, ","356,220","Solid & Striped is swimwear & après swim made from the finest globally sourced fabrics, guided by a desire for everlasting holidays and classic style.",Clothing (Brand),,https://www.facebook.com/SolidandStriped/,12920,https://www.instagram.com/solidandstriped,Solid and Striped
40,https://instagram.com/eyecandywear_clayart/,"356,422","We make:
-Charmed accessories
-Keychains
-Note and picture holders
-Little figurines
-& other cute stuff
-We also accept custom orders!",Jewelry/Watches,[eyecandyclayart@gmail.com],https://www.facebook.com/EyeCandyWear/,206,https://www.instagram.com/eyecandy-wear,Eye Candy Wear
41,http://www.WORNSTAR.com,"356,567",Wornstar Clothing®. Clothing for rock stars and fans. Custom stage clothing. Killer artwork designed by Stephen Jensen is featured on all of our pieces.,Clothing Store,[wornstar@wornstar.com],https://www.facebook.com/wornstar/,1273439,https://www.instagram.com/wornstar,WORNSTAR CLOTHING
42,www.supermarchepa.com,"356,602",,Butcher Shop,,https://www.facebook.com/supermarchepa/,2276,https://www.instagram.com/supermarchepa,Supermarché P.A.
43,http://www.ironfistclothing.com/,"356,878",LET'S PLAY!,Clothing (Brand),,https://www.facebook.com/ironfistclothing/,245246,https://www.instagram.com/ironfistclothing,Iron Fist Clothing
44,http://www.ranchogordo.com ,"356,893",Eat more beans.,Shopping & Retail,[customerservice@ranchogordo.com],https://www.facebook.com/ranchogordo/,11204,https://www.instagram.com/ranchogordo,Rancho Gordo
45,www.ragingheroes.com (english) www.ragingheroes.fr (français) www.ragingheroes.es (espana) ,"357,700","Striking wargaming minis from www.ragingheroes.com
Ask me as a Friend to see + updates: http://bit.ly/asharah
TGG2 Kickstarter: http://bit.ly/TGG2KSlive",Games/Toys,,https://www.facebook.com/RagingHeroes/,25991,https://www.instagram.com/ragingheroes,Raging Heroes
46,http://www.addictedtoaudio.com.au,"358,900",A bunch of audio enthusiasts enjoying a journey at the wonderful speed of sound. ,Electronics,[info@addictedtoaudio.com.au],https://www.facebook.com/AddictedtoAudio/,13343,https://www.instagram.com/addictedtoaudio,Addicted To Audio
47,http://www.alienoutfitters.com,"359,065","For aliens, by aliens.",Company,[contact@alienoutfitters.com],https://www.facebook.com/AlienOutfitters/,344789,https://www.instagram.com/alienoutfitters,Alien Outfitters
48,http://www.graceeleyae.com,"359,910","Our goal is to create products that help you be the best, healthiest, most beautiful you. www.satinlinedcaps.com",Clothing (Brand),,https://www.facebook.com/satinlinedcaps/,109099,https://www.instagram.com/satinlinedcaps,Satin-Lined Caps
49,www.coverfx.com www.twitter.com/coverfx www.youtube.com/coverfx www.pinterest.com/coverfx www.instagram.com/coverfx,"360,408",Make your own beautiful. ,Cosmetics Store,[customerservice@coverfx.com],https://www.facebook.com/CoverFX/,73637,https://www.instagram.com/coverfx,Cover FX
50,http://www.marinelayer.com,"360,470","Questions, comments, don't know what to text back? 
Shoot us note at help@marinelayer.com
Follow us on the 'gram: @marinelayer ",Clothing Store,[help@marinelayer.com],https://www.facebook.com/marinelayer/,19168,https://www.instagram.com/marinelayer,Marine Layer
51,http://www.julianedelman.com,"361,153","The official page of New England Patriot Julian Edelman.
For all business inquiries please email: julian@superdigital.co",Athlete,,https://www.facebook.com/JulianEdelman/,1093279,https://www.instagram.com/julianedelman,Julian Edelman
52,https://seinfeldsetreplica.com/,"361,793",Now you can finally own Jerry's apartment! ,Art,,https://www.facebook.com/SeinfeldSetReplica/,2065,https://www.instagram.com/seinfeldsetreplica,Seinfeld Set Replica
53,http://www.Roseshire.com,"362,034","Legendary rose arrangements, delivered. ",Product/Service,,https://www.facebook.com/roseshire/,84592,https://www.instagram.com/roseshire,Roseshire
54,http://wintercroft.com/pages/create,"362,702","We supply downloadable low poly mask templates that provide a strong foundation for your imagination to build upon. Download, print and build.",Product/Service,[info@wintercroft.com],https://www.facebook.com/wintercroft/,61971,https://www.instagram.com/wintercroft,Wintercroft Masks
55,http://www.tranquilomat.com,"363,440","The Tranquilo Soothing Mat is a lightweight and portable soothing vibrating mat designed to help on-the-go parents calm their crying baby anytime, anywhere by mimicking the sounds and motions of a mother's womb. ",Baby Goods/Kids Goods,,https://www.facebook.com/TranquiloMat/,54673,https://www.instagram.com/tranquilomat,Tranquilo Mat
56,http://www.daylightcurfew.com,"363,656",Daylight Curfew is a Brooklyn-based label. We release collaborative capsule and seasonal collections.,Clothing (Brand),[info@daylightcurfew.com],https://www.facebook.com/daylightcurfew/,11573,https://www.instagram.com/daylightcurfew,Daylight Curfew
57,www.tateandyoko.com,"363,965",TATE + YOKO is a Canadian menswear boutique with a unique concept. We carry some of the best cult Japanese denim brands with a focus on vintage style production methods.,Clothing Store,[info@tateandyoko.com],https://www.facebook.com/tateandyoko/,8391,https://www.instagram.com/tateandyoko,Tate + Yoko
58,http://littersf.com/ http://littersf.com/blogs/blog http://twitter.com/#!/littersf http://littersf.tumblr.com/ http://pinterest.com/littersf.com,"364,130",www.littersf.com ,Jewelry/Watches,,https://www.facebook.com/littersf/,9621,https://www.instagram.com/littersf,LITTER
59,http://www.mountainside-medical.com,"364,244",Quality medical supplies at competitive pricing. Visit our online store : www.mountainside-medical.com,Medical Supply Store,[sales@mountainside-medical.com],https://www.facebook.com/mountainsidemedical/,1613,https://www.instagram.com/mountainside-medical,"Mountainside Medical Equipment, Inc"
60,http://www.ripstopbytheroll.com,"364,673","Ripstop by the Roll is a leading micro-distributor of 1st quality ripstop nylon, silnylon, and other high-end DIY materials. ",Outdoor Equipment Store,[info@ripstopbytheroll.com],https://www.facebook.com/ripstopbytheroll/,3566,https://www.instagram.com/ripstopbytheroll,Ripstop by the Roll
61,https://easyskinz.com,"364,762","Stylish & Superior Protection for your device. Many colors, textures, designs, variations to choose from. Enjoy! :)",Website,[hello@easyskinz.com],https://www.facebook.com/easyskinz/,363641,https://www.instagram.com/easyskinz,EasySkinz
62,,"365,786",Post your best pics of your bare shelves. ;),Education,,https://www.facebook.com/shelfies/,85,https://www.instagram.com/shelfies,Naked Shelfies
63,http://www.benchislett.de/ http://www.lichtspass.de/home.html,"365,839","2 photographers - 30 Days - 1865 miles - Vancouver to Tijuana...........
2 Fotografen - 30 Tage - 3002 Kilometer - Vancouver nach Tijuana



",Community,,https://www.facebook.com/benandfrank/,14,https://www.instagram.com/benandfrank,It's the journey that Counts - No limit However 2x 5000 is enough
64,https://goo.gl/jWDDit,"366,021","Alpine Labs makes intuitive camera gear.

Create stunning photos, videos and time lapses with powerful and beautifully designed camera tools.",Camera/Photo,[info@alpinelaboratories.com],https://www.facebook.com/AlpineLaboratories/,8121,https://www.instagram.com/alpinelaboratories,Alpine Labs
65,http://cititrends.com,"366,377",Savings with style! Offering fashion & home goods for the family at 20%-70% off department store prices.,Retail Company,[info@cititrends.com],https://www.facebook.com/cititrends/,589338,https://www.instagram.com/cititrends,Citi Trends
66,http://www.swingdesign.com,"366,544","Swing Design is the largest seller of Silhouette Products.  We also carry Oracal, Siser, Graphtec, Cricut, and many more DIY brands",Website,[retailorders@swingdesign.com],https://www.facebook.com/SwingDesign/,117537,https://www.instagram.com/swingdesign,Swing Design
67,https://megatinycorp.com,"366,632",Mega Tiny Anti-Gravity Case Sticks Withhout Being Sticky. Also see our Asia Facebook Page here: https://www.facebook.com/MegaTinyCorpAsia,Retail Company,[hello@megatinycorp.com],https://www.facebook.com/megatinycorp/,10742,https://www.instagram.com/megatinycorp,Mega Tiny Corporation
68,http://catholic.org,"366,956","Catholic Online is the World's Catholic Library. 
",Religious Organization,[customerservice@catholiconline.email],https://www.facebook.com/catholiconline/,3092863,https://www.instagram.com/catholiconline,Catholic Online
69,https://www.petespaleo.com/,"367,080",Pete's Paleo brings fine dining to your cave at www.petespaleo.com.,Grocery Store,[info@petespaleo.com],https://www.facebook.com/PetesPaleo/,29985,https://www.instagram.com/petespaleo,Pete's Paleo
70,http://www.waxworkrecords.com,"367,507",www.waxworkrecords.com,Record Label,,https://www.facebook.com/waxworkrecords/,25259,https://www.instagram.com/waxworkrecords,Waxwork Records
71,http://www.backtotheroots.com/,"367,804",http://www.backtotheroots.com,Company,[contact@backtotheroots.com],https://www.facebook.com/backtotheroots/,66800,https://www.instagram.com/backtotheroots,Back to the Roots
72,https://fluidstance.com,"367,810",You were designed to move - It's likely your workspace was not. FluidStance creates beautifully designed tools that bring motion to any common workspace. ,Product/Service,,https://www.facebook.com/FluidStance/,5956,https://www.instagram.com/fluidstance,FluidStance
73,https://www.asmdssgear.com,"367,889",ASMDSS Branded clothing produced by veterans at Grunt Style,Clothing (Brand),,https://www.facebook.com/ASMDSSGear/,14047,https://www.instagram.com/asmdssgear,ASMDSS Gear
74,https://sengled.com/,"368,280","Sengled makes the world’s most advanced light bulbs – with sound systems, security cameras & other smart features – making home more fun, simple & secure.",Electronics,[mjohnson@sengled.com],https://www.facebook.com/Sengled/,13763,https://www.instagram.com/sengled,Sengled
75,http://www.primitiveskate.com,"368,662",The official Primitive Skateboarding Facebook page. Shop now at http://primitiveskate.com,Product/Service,,https://www.facebook.com/primitiveskate/,388548,https://www.instagram.com/primitiveskate,Primitive Skateboarding
76,http://InspiringWave.com,"368,733",Your Online Store For All Of The Inspiring TV Shows And Movies Products!,Website,,https://www.facebook.com/InspiringWave/,19994,https://www.instagram.com/inspiringwave,InspiringWave
77,http://caseofmine.com/,"368,850","Email: hello@caseofmine.co  
Whatsapp/Wechat: 012-329 0314 (no call) 
https://instagram.com/Casesofmine
Retail Shop: Ipoh Parade 3rd floor",Retail Company,,https://www.facebook.com/CaseOfMine/,510779,https://www.instagram.com/caseofmine,Case Of Mine
78,http://bit.ly/Zyppah-Buy-Now,"368,941","ZYPPAH is the superior anti-snoring oral device that holds the tongue in place to prevent it from closing the airway during sleep, the cause of snoring.",Product/Service,,https://www.facebook.com/zyppah/,7317,https://www.instagram.com/zyppah,Zyppah | Anti-Snoring Oral Appliance
79,http://www.liquidbarn.com,"369,381","Supplier of high quality compounds, nicotine and lab supplies",Wholesale & Supply Store,[ash@liquidbarn.com],https://www.facebook.com/liquidbarn/,2885,https://www.instagram.com/liquidbarn,Liquid Barn
80,www.jazzbacks.com,"369,730",Jazz playalongs (or play alongs) - backing tracks. Buy only the tracks you want. For ALL instruments and vocalists - duos too! Learn jazz. Jam along. Do gigs with them. Make your demos with these.,Product/Service,,https://www.facebook.com/Jazzbacks/,1398,https://www.instagram.com/jazzbacks,Jazzbacks Downloadable Backing Tracks
81,http://www.leadershipiq.com/,"369,758","Our groundbreaking research is changing how companies view employee engagement, hiring, and leadership.",Business Consultant,[info@leadershipiq.com],https://www.facebook.com/LeadershipIQ/,3551,https://www.instagram.com/leadershipiq,Leadership IQ
82,http://www.opengamingstore.com/,"370,033",The Open Gaming Store is open 24x7 to bring you all your gaming needs NOW! Support Open Gaming by shopping the Open Gaming Store!,Retail Company,,https://www.facebook.com/opengamingstore/,2468,https://www.instagram.com/opengamingstore,Open Gaming Store
83,https://www.flatseven.net,"370,184","Welcome to FLATSEVEN official facebook page!

A designer fashion brand which specializes in clothing and accessories.",Clothing (Brand),,https://www.facebook.com/FLATSEVEN/,188748,https://www.instagram.com/flatseven,FLATSEVEN Mens Designer Clothes
84,http://www.universalstore.com,"371,294",Universal Store has you covered. Literally.,Clothing (Brand),[help@universalstore.com.au],https://www.facebook.com/universalstore/,66644,https://www.instagram.com/universalstore,Universal Store
85,,"371,316",Naelofar hijab ! Founder ; Neelofa ! Rm50 only ! Whatsapp 019 9888 070,Clothing (Brand),,https://www.facebook.com/Naelofarhijab/,1094,https://www.instagram.com/naelofarhijab,Naelofar kelantan
86,http://www.fixtonline.com,"371,545","Home of amazing artists like Celldweller, Blue Stahli, Scandroid, Circle of Dust, The Qemists, Voicians, I Will Never Be The Same, Raizer, SeamlessR, + the FiXT Store!  www.fixtonline.com",Record Label,,https://www.facebook.com/fixtmusic/,24194,https://www.instagram.com/fixtstore,FiXT
87,www.quadlockcase.com,"372,346","Available from www.quadlockcase.com - Shipping Worldwide with FREE local shipping to UK, USA Canada and Australia. EU shipping from $7EUR",Outdoor & Sporting Goods Company,,https://www.facebook.com/quadlockcase/,242411,https://www.instagram.com/quadlockcase,Quad Lock
88,http://www.winkylux.com,"372,430","Luxury addictive cosmetics. Get your Glossy Boss now!

A Glow Concept Company",Health/Beauty,[info@winkylux.com],https://www.facebook.com/winkylux/,14043,https://www.instagram.com/winkylux,Winky Lux
89,http://www.bedrocan.com,"372,582",Bedrocan is currently the only company in the world that produces standardised medicinal-grade cannabis for a number of international governments. ,Medical Company,[info@bedrocan.com],https://www.facebook.com/Bedrocan/,4269,https://www.instagram.com/bedrocan,Bedrocan
90,http://www.mobicity.com.br,"372,665","A Mobicity conecta colaboradores em organizações por suas afinidades e localizações, oferecendo aos gestores um mapa modal e gráficos para decisões de mobi",Computer Company,[contato@mobi-city.net],https://www.facebook.com/Mobicity/,999,https://www.instagram.com/mobi-city,Mobicity
91,http://trustbasket.com/,"372,907",Online Gardening Megastore.,Local Business,,https://www.facebook.com/TrustBasket/,135181,https://www.instagram.com/trustbasket,TrustBasket.com
92,http://www.solesteals.com,"375,755","Get exclusive access to solesteals.com where you will find inventory up to 40% off market value.
",Retail Company,[support@solesteals.com],https://www.facebook.com/solesteals/,3215,https://www.instagram.com/solesteals,Sole Steals
