,Link,Ranking,about,category,email,facebook page,facebook subscribers,instagram Url,name
279,http://JustLoveCats.com,"434,779",Just Love Cats is for people who absolutely love cats! Please make sure you like our page! ,Website,[support@justlovecats.com],https://www.facebook.com/justlovecats/,118162,https://www.instagram.com/justlovecats,Just Love Cats
280,https://vapemonstercity.co.uk/,"434,995",We take a lot of pride in sourcing some of the best Dry Herb & Concentrate Vaporizers from around the world and getting them straight to your door. ,Retail Company,[sales@vapemonstercity.co.uk],https://www.facebook.com/vapemonstercity/,8,https://www.instagram.com/vapemonstercity,Vape Monster City
281,http://www.fewmoda.com,"435,177","FEW MODA is a New York-based Woman Clothing Shopping Website 


https://www.fewmoda.com



",Shopping & Retail,,https://www.facebook.com/fewmoda/,47727,https://www.instagram.com/fewmoda,Few Moda
282,https://posteroz.com,"435,695","We believe that good home decoration starts with posters, so we have all the trendy posters at Posteroz.",Website,,https://www.facebook.com/posteroz/,0,https://www.instagram.com/posteroz,Posteroz
283,www.rokform.com,"435,711","Rokform is the producer of protective and mountable cases, mounts and accessories for Apple iPhone, iPad, and Samsung Galaxy mobile devices. www.rokform.com
",Product/Service,[info@rokform.com],https://www.facebook.com/Rokform/,208715,https://www.instagram.com/rokform,Rokform
284,www.fit-fresh.com,"435,715","Insulated lunch bags, portion control containers, and more convenient lunch solutions for healthy eating on the go! www.fit-fresh.com",Retail Company,[customerservice@fitandfresh.com],https://www.facebook.com/FitFresh/,27480,https://www.instagram.com/fit-fresh,Fit & Fresh
285,http://screamingowl.com,"436,301",http://screamingowl.com is a North Carolina based business run by a mom who wants you to save money!  Rock bottom prices w/our unique preorder method!,Website,,https://www.facebook.com/screamingowl/,2793891,https://www.instagram.com/screamingowl,Screaming Owl
286,http://soar.gg,"436,570",Official Facebook page of SoaR Gaming! Like to stay up to date on all things SoaR!,Brand,[contact@soar.gg],https://www.facebook.com/SoaR/,20264,https://www.instagram.com/soar,SoaR Gaming
287,http://www.lofty.com,"436,573",LOFTY is the trusted online marketplace for art and collectibles.,Website,[contact@lofty.com],https://www.facebook.com/lofty/,16679,https://www.instagram.com/lofty,Lofty
288,http://www.rusticsinks.com,"437,686",We specialize in creating higher quality items and unique designs rather than large quantities of more mass produced products. ,Retail Company,[denise@rusticsinks.com],https://www.facebook.com/RusticSinks/,947,https://www.instagram.com/rusticsinks,Rustic Sinks
289,http://www.futgenie.com,"437,870","FUTGENIE - Buy FIFA packs. Win ultimate team coins instantly, instant automated withdrawals & PayPal accepted. Voted #1 pack site. ",Website,,https://www.facebook.com/futgenie/,18902,https://www.instagram.com/futgenie,FUTGenie
290,http://www.marleynatural.com/,"438,397",Marley Natural is the official cannabis brand of Bob Marley.,Retail Company,,https://www.facebook.com/marleynaturalshop/,2222,https://www.instagram.com/marleynaturalshop,Marley Natural Shop
291,www.herdailydeal.com/,"438,531","
Her Daily Deal  is a leading online retailer known to represent quality and comfort. We believe that the key to our growth is your satisfaction, that's why we work around the clock to deliver your orders and answer your questions ",Clothing (Brand),[support@herdailydeal.com],https://www.facebook.com/herdailydeal/,34220,https://www.instagram.com/herdailydeal,Her Daily Deal
292,http://REBEL8.com,"438,810","In 2003, REBEL8 humbly began in a small San Francisco studio apartment with five-hundred bucks. ",Clothing (Brand),,https://www.facebook.com/rebel8/,305067,https://www.instagram.com/rebel8,REBEL8
293,www.studioneat.com,"439,729",Tom Gerhardt and Dan Provost are two designers who work under the moniker Studio Neat. We enjoy making simple things and making things simple.,Local Business,[hello@studioneat.com],https://www.facebook.com/studioneat/,3164,https://www.instagram.com/studioneat,Studio Neat
294,www.curriculumloft.com,"440,401","Manage & share your digital curriculum, sync content on student devices, and automatically assess student data!",Software,,https://www.facebook.com/CurriculumLoft/,88,https://www.instagram.com/curriculumloft,CurriculumLoft
295,https://www.knuckleheadvapes.com,"441,738","Online Vape gear store
Run by Vapers for Vapers, we provide top quality vaping products, DIY Juice solutions
Customer service 9-5pm Mon-Fri
",Shopping & Retail,,https://www.facebook.com/knuckleheadvapes/,7408,https://www.instagram.com/knuckleheadvapes,Knucklehead Vapes Ltd
296,http://cartervintage.com,"442,309","Christie and Walter Carter bring a combined 50 years of experience  in vintage guitars and other fretted instruments. We offer a friendly, comfortable place for fine guitars and the people who appreciate them.",Musical Instrument Store,"[christie@cartervintage.com, walter@cartervintage.com]",https://www.facebook.com/CarterVintage/,15689,https://www.instagram.com/cartervintage,Carter Vintage Guitars
297,http://www.bearbutt.com,"442,367","The Greatest Hammock Company This Universe Has Seen With Top Quality Gear At Half The Cost Of The Other Guys And Real Customer Service.

",Product/Service,[team@bearbuttteam.com],https://www.facebook.com/BearButtTeam/,62809,https://www.instagram.com/bearbuttteam,Bear Butt
298,http://www.stevenbrownart.co.uk,"442,459","Colourful characters, landscapes and lifestyle products by Steven Brown add an attractive twist to any home, with a design to suit everyone. ",Artist,,https://www.facebook.com/StevenBrownArt/,462297,https://www.instagram.com/stevenbrownart,Steven Brown Art
299,http://www.districtf5ve.com,"442,762","District F5VE: creators of the comp caps, slam caps, and the CSMNT",Tobacco Store,[info@districtf5ve.com],https://www.facebook.com/districtf5ve/,2091,https://www.instagram.com/districtf5ve,District Five Vape Store
300,www.routinebaseball.com,"442,897","Lifestyle Baseball Brand. www.routinebaseball.com

FREE US shipping with orders over $75 and FREE exchanges in the US as well. ",Clothing (Brand),[info@routinebaseball.com],https://www.facebook.com/routinebaseball/,102660,https://www.instagram.com/routinebaseball,Routine Baseball
301,www.mimijumi.com,"442,936","mimijumi is a design and innovation driven company specializing in simple, safe and natural products for the modern family.  http://www.mimijumi.com",Baby Goods/Kids Goods,,https://www.facebook.com/mimijumi/,46902,https://www.instagram.com/mimijumi,Mimijumi
302,http://limericki.com,"443,081",We're Lime Ricki Swimwear - providing fun one-pieces and tankinis for every girl and woman. Because you deserve to feel comfortable + confident in a swimsuit. And because it's always summer somewhere. Visit us online at www.limericki.com. ,Clothing (Brand),[customerservice@limericki.com],https://www.facebook.com/limericki/,24992,https://www.instagram.com/limericki,Lime Ricki Swimwear
303,http://camdenwatchcompany.com/,"443,197","Creators of fine timepieces designed in the heart of Camden Town.

Free Shipping Worldwide.

",Shopping & Retail,[info@camdenwatchcompany.com],https://www.facebook.com/camdenwatchcompany/,13285,https://www.instagram.com/camdenwatchcompany,The Camden Watch Company
304,www.snowboardaddiction.com,"443,381","Improve Your Riding:
http://snowboardaddiction.com/",Education Website,[info@snowboardaddiction.com],https://www.facebook.com/snowboardaddiction/,153154,https://www.instagram.com/snowboardaddiction,Snowboard Addiction
305,http://www.stayhomeclub.com,"443,449",A lifestyle brand for people with no life.http://www.stayhomeclub.com,Website,[hello@stayhomeclub.com],https://www.facebook.com/StayHomeClub/,17414,https://www.instagram.com/stayhomeclub,Stay Home Club
306,https://onlineaesthetic.com/,"443,516",WANNA LOOK AESTHETICALLY PLEASING OFFLINE WITHOUT SPENDING LOTS A $$$? WELL WE PROVIDE ONLY THE LATEST IN ONLINE AESTHETIC & VAPOURWAVE FASHION FOR LOW PRI,Retail Company,[support@onlineaesthetic.com],https://www.facebook.com/onlineaesthetic/,159,https://www.instagram.com/onlineaesthetic,Online Aesthetic
307,http://www.pogopirate.com,"443,750","Best Pokemon Go accounts
Level 25 to 37 - 3500 CP
www.pogopirate.com
Highest CP/IV Accounts from Level 25 to 37 Instant delivery. Great value, best accounts available worldwide.",Local Business,,https://www.facebook.com/PogoPirate/,663,https://www.instagram.com/pogopirate,PogoPirate
308,www.giantvintage.com http://twitter.com/GiantVintage,"443,794","Visit http://www.giantvintage.com
Follow Us!
Twitter- @GiantVintage
Instagram- @giantvintage
Tumblr- GiantVintage.tumblr.com",Company,,https://www.facebook.com/GiantVintage/,25693,https://www.instagram.com/giantvintage,I Like Giant Vintage Sunglasses
309,https://www.PilotFashion.com,"443,811","Hurry, Up To 70% Off SALE! Share with your BFF! Shop Here: http://bit.ly/1EIvG30",Clothing (Brand),[info@pilotfashion.com],https://www.facebook.com/pilotfashion/,9427,https://www.instagram.com/pilotfashion,Pilot Fashion
310,http://www.20buckspin.com http://www.twitter.com/20buckspinlabel,"443,879",20 BUCK SPIN: Records For People.,Record Label,,https://www.facebook.com/20buckspin/,17105,https://www.instagram.com/20buckspin,20 Buck Spin
311,https://www.bravoconcealment.com,"444,093","Thanks for visiting us on Facebook. Give us a like if you enjoy our page and check out our website  www.bravoconcealment.com
(956) 783-7682",Retail Company,[orders@bravoconcealment.com],https://www.facebook.com/BravoConcealment/,291705,https://www.instagram.com/bravoconcealment,Bravo Concealment Holsters
312,http://TwiddleCube.com,"444,480",,Product/Service,[contact@twiddlecube.com],https://www.facebook.com/twiddlecube/,397,https://www.instagram.com/twiddlecube,Twiddle Cube
313,http://www.child1st.com,"444,634",Reading & math resources especially designed for struggling learners. ,Publisher,[info@child1st.com],https://www.facebook.com/Child1st/,3522,https://www.instagram.com/child1st,Child1st Publications LLC
314,https://www.survivalstraps.com,"445,235",Click this link to visit our website: https://www.survivalstraps.com,Product/Service,,https://www.facebook.com/survivalstraps/,711148,https://www.instagram.com/survivalstraps,Survival Straps
315,www.kerusso.com,"445,836",Since 1987 Kerusso has been creating Christian T-Shirts that help fulfill the great commission of preaching the gospel.,Religious Organization,[social@kerusso.com],https://www.facebook.com/kerusso/,22067,https://www.instagram.com/kerusso,Kerusso
316,,"445,863","Includes: a pressurized opener for easy opening,
an ever-sharp foil cutter for smooth cut results,
a fast-acting aerator for your fanciest reds.",Wine/Spirits,,https://www.facebook.com/The.Perfect.Wine.Opener/,48,https://www.instagram.com/theperfectwineopener,The Perfect Wine Opener
317,http://leonardandchurch.com,"445,928",Simple. Handcrafted. Born in NYC.,Product/Service,,https://www.facebook.com/leonardandchurch/,19493,https://www.instagram.com/leonardandchurch,Leonard & Church
318,http://www.commonculture.co,"446,526",,Product/Service,,https://www.facebook.com/commonculture/,2298,https://www.instagram.com/commonculture,Common Culture
319,http://fragrancebuy.ca/,"446,542","Welcome to FragranceBuy.ca, Canada's Online Warehouse Sale for Authentic Brand Name Fragrances. 

Our goal: To provide customers with warehouse sale pricing at the comfort of their homes. 

No lineups.
Bargain Prices.
Real Brands.
Buy. Shop. Save.","Beauty, Cosmetic & Personal Care",[sales@fragrancebuy.ca],https://www.facebook.com/fragrancebuy/,13223,https://www.instagram.com/fragrancebuy,Fragrancebuy - Canada's Online Warehouse Sale
320,http://www.BeMonogrammed.com,"446,662","Be Monogrammed is an online boutique, and a division of The Purple Mermaid, Inc. Our brand features Monogram Jewelry, Gifts & Accessories. ",Jewelry & Watches Store,[luanncap@thepurplemermaid.com],https://www.facebook.com/BeMonogrammed/,29881,https://www.instagram.com/bemonogrammed,The Purple Mermaid
321,http://www.butiyoga.com,"446,885","Buti Yoga® fuses dynamic yoga asana with cardio-intensive dance and deep abdominal toning. These workouts range 60-90 minutes and length and average 700-800 calories burned per session. Certification, online courses + more butiyoga.com",Yoga Studio,[clientcare@butiyoga.com],https://www.facebook.com/butiyoga/,65293,https://www.instagram.com/butiyoga,Buti Yoga
322,http://www.r13denim.com,"447,122",Instagram: shopr13,Clothing (Brand),,https://www.facebook.com/r13denim/,6105,https://www.instagram.com/r13denim,R13 Denim
323,http://www.500level.com,"447,798","500 LEVEL is the ultimate sports apparel and fan gear store. We feature custom T-shirts for NFL, MLB, and NHL Players Associations and Legends of all sports!
  ",Clothing (Brand),[staff@500level.com],https://www.facebook.com/500level/,38777,https://www.instagram.com/500level,500 LEVEL
324,http://www.printkeg.com,"447,980","Super Cheap Posters, Flyers Postcards and Booklets!! http://www.printkeg.com",Screen Printing & Embroidery,[contact@printkeg.com],https://www.facebook.com/printkeg/,4696,https://www.instagram.com/printkeg,PrintKeg.com
325,http://www.BBBRANDED.com,"448,086","Fashion, Lifestyle Apparel, Sneaker Boutique....Be Unique!",Footwear Store,[emailus@bbbranded.com],https://www.facebook.com/bbbranded/,8041,https://www.instagram.com/bbbranded,BB Branded Boutique
326,http://www.arkkcopenhagen.com,"448,784",In love with sneakers,Clothing (Brand),[support@arkkcopenhagen.com],https://www.facebook.com/arkkcopenhagen/,51455,https://www.instagram.com/arkkcopenhagen,ARKK Copenhagen
327,http://www.lightningvapes.com,"449,122","All the RBA Materials you need! Silica Wick,Genuine Ekowool, Kanthal Wire,Non Resistance Nickel Wire, Stainless Steel Mesh and more!",Commercial & Industrial,,https://www.facebook.com/lightningvapes/,18049,https://www.instagram.com/lightningvapes,Lightning Vapes
328,https://DiscoverCBD.com,"449,135","Shipped to all 50 states! Low prices, Fast shipping. Largest selection on the web of hemp CBD capsules, tinctures, E-liquids, Oils, Edibles, Dabs and more!",Alternative & Holistic Health Service,[info@discovercbd.com],https://www.facebook.com/discovercbd/,4576,https://www.instagram.com/discovercbd,Discover CBD
329,www.dashwallets.com,"449,910","The world's first quickdraw wallet by Steven Elliot. Dash is thinner, faster, and smarter than your average wallet. Buy at www.dashwallets.com
",Clothing (Brand),[hello@dashwallets.com],https://www.facebook.com/DashWallets/,3450,https://www.instagram.com/dashwallets,Dash Wallets
330,http://www.theunbrandedbrand.com,"450,180","The Unbranded Brand is jeans with no branding, no washes, no embroidery, no ad campaigns and no celebrities.So, all you pay for is the product! Made from top quality rope-dyed selvedge denim.",Clothing (Brand),,https://www.facebook.com/TheUnbrandedBrand/,15416,https://www.instagram.com/theunbrandedbrand,The Unbranded Brand
331,http://www.crepslocker.com,"450,266",,Men's Clothing Store,[hello@crepslocker.com],https://www.facebook.com/crepslocker/,677,https://www.instagram.com/crepslocker,Crepslocker
332,http://outdoorstactical.com,"450,352",Latest Releases of Tactical and outdoor Gear.,Community,,https://www.facebook.com/outdoorstactical/,268354,https://www.instagram.com/outdoorstactical,Outdoors Tactical
333,http://amnautical.com,"450,566","Your ultimate resource in nautical charts, books, flags, maritime compliance & services - Serving the maritime industry since 1977. ",Bookstore,[sales@amnautical.com],https://www.facebook.com/amnautical/,412,https://www.instagram.com/amnautical,American Nautical Services
334,http://www.karma-yoga-shop.com,"450,921",Karma Yoga Shop déniche les meilleurs objets et les plus beaux bijoux spirituels aux 4 coins du monde.,Health/Beauty,[contact@karma-yoga-shop.com],https://www.facebook.com/KarmaYogaShop/,134903,https://www.instagram.com/karma-yoga-shop,Karma Yoga Shop
335,,"450,927",,Clothing Store,[tanjaneunaber@gmail.com],https://www.facebook.com/neunaber/,16,https://www.instagram.com/neunaber,Neunaber Bügelservice
336,http://retropatents.com,"451,588",Retro Patents has the best collection of vintage patents that shaped the technology world. Buy handmade designs online and get them shipped to your door.,Shopping & Retail,,https://www.facebook.com/retropatents/,409,https://www.instagram.com/retropatents,Retro Patents
337,www.LivingRoyal.com,"453,093","VISIT US: http://LIVINGROYAL.COM/ • CALL US: 312-906-7600 • WRITE US: INFO@LIVINGROYAL.COM //
#livingroyal",Clothing (Brand),[info@livingroyal.com],https://www.facebook.com/Livingroyal/,92810,https://www.instagram.com/livingroyal,LIVINGroyal
338,http://mamas1st.com,"453,368",Mamas First Helpers is a new community and a business for pregnant and new moms in the Los Angeles area. We help you with everything you need help with �,Community,,https://www.facebook.com/mamasfirst/,4,https://www.instagram.com/mamasfirst,Mamas First
339,http://www.drbrandtskincare.com,"453,471","dr. brandt® skincare is the anti-aging line of choice for celebrities, beauty insiders, and real women worldwide. ",Health/Beauty,[customerservice@drbrandtskincare.com],https://www.facebook.com/drbrandtskincare/,58338,https://www.instagram.com/drbrandtskincare,dr. brandt Skincare
340,http://www.FlynnSkye.com,"453,496","A line inspired by my daughter, designed in Venice, made in LA...for you.  All done with the earth in mind. XO",Shopping & Retail,[smile@flynnskye.com],https://www.facebook.com/Flynnskyeclothing/,12846,https://www.instagram.com/flynnskye,Flynn Skye by Amber Farr
341,www.pipercleo.com,"453,553",Hand Made Jewerly inspired by my family and friends ,Brand,[info@pipercleo.com],https://www.facebook.com/pipercleo/,8914,https://www.instagram.com/pipercleo,PiperCleo
342,http://reprapchampion.com,"454,382",We sell spare parts for 3D Printers,Information Technology Company,[reprapchampion@gmail.com],https://www.facebook.com/reprapchampion/,633,https://www.instagram.com/reprapchampion,RepRap Champion
343,http://www.surfcityparacord.com,"455,201",Be prepared for an emergency with the Bug Out Frag™ Survival Kit. 45' USA made 550 Paracord and packed with 28 essential survival tools. Get yours today.,Outdoor & Sporting Goods Company,[info@surfcityparacord.com],https://www.facebook.com/SurfCityParacord/,6148,https://www.instagram.com/surfcityparacord,"Surf City Paracord, Inc."
344,http://noblespin.com,"455,393",The official facebook page of Noble Spin,Product/Service,,https://www.facebook.com/NobleSpin/,16784,https://www.instagram.com/noblespin,NobleSpin
345,https://www.thebirdhousechick.com,"456,316","Unique birdhouses & bird feeders! Handcrafted bird baths, and cool yard art too~ 
www.thebirdhousechick.com",Retail Company,[info@thebirdhousechick.com],https://www.facebook.com/thebirdhousechick/,3212,https://www.instagram.com/thebirdhousechick,The Birdhouse Chick
346,http://www.pantryboy.com,"456,706",Every week we send you a box of farm-fresh ingredients with delicious recipes.,Food Delivery Service,[order@pantryboy.com],https://www.facebook.com/pantryboy/,12824,https://www.instagram.com/pantryboy,Pantry Boy
347,http://www.royalteeslondon.co.uk,"456,734",Icon Merch,Clothing (Brand),[info@royaltees-london.com],https://www.facebook.com/royalteeslondon/,16075,https://www.instagram.com/royalteeslondon,Royal Tees London
348,http://www.machusonline.com,"456,969",Machus is a modern men's clothing store. We walk the line between streetwear and high fashion. ,Men's Clothing Store,[info@machusonline.com],https://www.facebook.com/machusonline/,6419,https://www.instagram.com/machusonline,Machus
349,http://bit.ly/2qy9dVR,"457,422",Visit us at http://www.fragrantjewels.com/ to purchase an exquisitely scented candle and uncover a hidden jewel.,Retail Company,,https://www.facebook.com/fragrantjewels/,1206119,https://www.instagram.com/fragrantjewels,Fragrant Jewels
350,http://www.beeinspiredclothing.com,"457,765","Fast growing Menswear Clothing brand based in the UK
www.beeinspiredclothing.com
enquiries please email support@beeinspiredclothing.com 
",Clothing (Brand),[support@beeinspiredclothing.com],https://www.facebook.com/beeinspiredclothing/,549142,https://www.instagram.com/beeinspiredclothing,Bee Inspired Clothing
351,http://www.shophopes.com,"457,789",SNAPCHAT: shophopes � 1 location in Georgia � we ship worldwide! � FREE shipping in U.S. and Canada � tag us to be featured! #shophopes �,Wholesale & Supply Store,[support@shophopes.com],https://www.facebook.com/shophopes/,293811,https://www.instagram.com/shophopes,Hope's
352,www.thefowndry.com,"457,961","Everything cool, quirky and cutting edge that’s happening in the world right now. Products, gifts, games, gadgets, videos and zombies (of course). www.thefowndry.com",Retail Company,[info@thefowndry.com],https://www.facebook.com/TheFowndry/,17804,https://www.instagram.com/thefowndry,The Fowndry
353,http://www.fatherjohnmisty.com,"458,078","FATHERJOHNMISTY.COM

New album Pure Comedy available now via Sub Pop & Bella Union.",Musician/Band,,https://www.facebook.com/fatherjohnmisty/,280738,https://www.instagram.com/fatherjohnmisty,Father John Misty
354,www.miabambinaboutique.com,"458,121","Mia Bambina Boutique - represents  Premium Girls Dresses for every occasion such as Weddings, First Communions, Birthday and Baptism. 
European quality and trendy designs will make her special day a fairy tale.
 ""We Bring the Beauty into the World""",Shopping & Retail,[miabambinaboutique@yahoo.ca],https://www.facebook.com/miabambinaboutique/,56504,https://www.instagram.com/miabambinaboutique,Mia Bambina Boutique
355,http://www.lampsusa.com/,"458,538","LampsUSA offers the largest variety of fixtures, floor and table lamps, lampshades, outdoor lighting, bathroom fixtures and other home ",Home Decor,[sales@lampsusa.com],https://www.facebook.com/LampsUSA/,5927,https://www.instagram.com/lampsusa,LampsUSA.com
356,www.HoopCulture.com,"458,941",Hoop Culture is a streetwear brand sculpted from the game of basketball. Check us out! • www.hoopculture.com • @hoopculture,Clothing (Brand),[info@hoopculture.com],https://www.facebook.com/hoopculture/,123701,https://www.instagram.com/hoopculture,Hoop Culture
357,https://carbonfibergear.com,"459,303","Lifestyle products made with or out of carbon fiber. Carbon Fiber is the New Black®
 https://carbonfibergear.com",Retail Company,[info@carbonfibergear.com],https://www.facebook.com/carbonfibergear/,23714,https://www.instagram.com/carbonfibergear,Carbon Fiber Gear
358,http://www.DeltaChildren.com,"459,385","Have a question? Let us help. Contact our Consumer Care Team Monday-Friday 8:30am-6pm (EST) at 1-800-377-3777 or at customercare-web@deltachildren.com.

*Due to server restrictions, we are unable to accept emails with image attachments at this time.*",Baby Goods/Kids Goods,[customercare-web@deltachildren.com],https://www.facebook.com/deltachildren/,121579,https://www.instagram.com/deltachildren,Delta Children
359,http://www.humblejuiceco.com,"459,500",Affordable juice for cloud chasers!,Website,[info@humblejuiceco.com],https://www.facebook.com/humblejuiceco/,5024,https://www.instagram.com/humblejuiceco,Humble Juice Co.
360,http://www.fazioscatjewelry.com/,"459,672","I design breed specific life like animal replicas.  If you love cats, dogs, horses, bears, or even bats, check out my website.  
www.fazioscatjewelry.com",Public Figure,[kay@fazioscatjewelry.com],https://www.facebook.com/AnimalJewelry/,178,https://www.instagram.com/animal-jewelry,Kay Fazio
361,http://jskis.com,"460,370","It's just skiing.
www.Jskis.com",Outdoor & Sporting Goods Company,[info@jskis.com],https://www.facebook.com/jskis/,47545,https://www.instagram.com/jskis,J skis
362,http://www.RnAReSet.com,"460,899",Experience Perfect Nutrition Suitable for Every Individual at Any Level with The Completement Formulas™ ,Alternative & Holistic Health Service,[support@rnareset.com],https://www.facebook.com/RnAReSet/,7258,https://www.instagram.com/rnareset,RnA ReSet
363,http://www.humbuckermusic.com,"460,933","Humbucker Music ( www.humbuckermusic.com ) is a music store specializing in higher-end boutique guitars, amps, pedals, and other music gear. ",Musical Instrument Store,[sales@humbuckermusic.com],https://www.facebook.com/HumbuckerMusic/,36391,https://www.instagram.com/humbuckermusic,Humbucker Music
364,http://www.pcgamingrace.com,"461,006",Take your PRO gaming experience to the ultimate level with our Glorious PC gaming hardware/accessories.,Computers (Brand),,https://www.facebook.com/pcgamingrace/,14885,https://www.instagram.com/pcgamingrace,Glorious PC Gaming Race
365,www.ProjectRepat.com,"461,097","We make the most affordable t-shirt quilt on the market. Over 100,000 happy customers - send us your t-shirts today! www.projectrepat.com/",Shopping & Retail,[madeinusa@projectrepat.com],https://www.facebook.com/ProjectRepat/,312341,https://www.instagram.com/projectrepat,Project Repat
366,comfortableclub.com,"461,578",,Clothing (Brand),,https://www.facebook.com/comfortableclub/,11,https://www.instagram.com/comfortableclub,Comfortable Club
367,,"462,132",The simple start of CartEzy was fuelled from personal demand and the basic desire of having something different and unique. ,Clothing (Brand),[mailcartezy@gmail.com],https://www.facebook.com/cartezy/,79,https://www.instagram.com/cartezy,Cartezy
368,www.alltheanime.com,"462,237",UK based anime company based in Glasgow - bringing you great content to the big screen and to home video.,Movie/Television Studio,,https://www.facebook.com/alltheanime/,19029,https://www.instagram.com/alltheanime,Anime Limited
369,,"462,638",,Community,,https://www.facebook.com/PinBlock/,13,https://www.instagram.com/pinblock,Pin Block
