,Link,Ranking,about,category,email,facebook page,facebook subscribers,instagram Url,name
187,http://WorldwideCyclery.com,"405,837","An epic bicycle shop on a mission to redefine what a bike shop can be. Online or in-store, stocking all the good stuff. www.worldwidecyclery.com",Bicycle Shop,[info@worldwidecyclery.com],https://www.facebook.com/worldwidecyclery/,11816,https://www.instagram.com/worldwidecyclery,Worldwide Cyclery
188,http://www.cleanthemes.net,"406,151",Premium WordPress Themes On ThemeForest.net,Web Designer,[info@cleanthemes.net],https://www.facebook.com/cleanthemes/,24,https://www.instagram.com/cleanthemes,Clean Themes Studio
189,www.animography.net,"406,175",Anim(ated typ)ography.,Product/Service,,https://www.facebook.com/animography/,13146,https://www.instagram.com/animography,Animography
190,https://uniquegiftsstore.net/,"406,439",Unique Gifts Store,Website,,https://www.facebook.com/uniquegiftsstore/,15,https://www.instagram.com/uniquegiftsstore,Unique Gifts Store
191,https://m.facebook.com/TrubRain/?tsid=0.2690340759029183&source=typeahead,"407,163",Born in 88 I go by trub rain I am a VA native music is my life 757 show some support my music varies from party to r&b like share comment I love feedback,Artist,,https://www.facebook.com/TrubRain/,271,https://www.instagram.com/trubrain,Trub
192,http://www.productmargje.com,"407,166",laybag is a bag wich you can unzip to a picknick blanket. multifunctional ! because it is also suitable for a 17 inch macbook ! now available for 50 euro !,Bags/Luggage,,https://www.facebook.com/laybag/,561,https://www.instagram.com/laybag,Laybag
193,"http://annsfabulousfinds.com
http://www.annsfabulouscloseouts.com/
http://shop.ebay.com/annsfabfinds/m.html
","407,353","The coolest consignment shop on the block!

http://annsfabulousfinds.com/

Hermès, Chanel, Louis Vuitton, Balenciaga, Fendi, Gucci, Prada... and more!",Retail Company,,https://www.facebook.com/annsfabulousfinds/,4522,https://www.instagram.com/annsfabulousfinds,Ann's Fabulous Finds
194,timetimer.com,"408,100",Official page of Time Timer - the visual timer that helps you manage time more effectively! Learn how at: http://timetimer.com,Office Supplies,[support@timetimer.com],https://www.facebook.com/TimeTimer/,3627,https://www.instagram.com/timetimer,Time Timer - Make Every Moment Count
195,https://blazedwear.com,"408,238",Blazed Wear™ Official Stoner Uniform | Men's Wear | Ladies Wear | Accessories | Worldwide Shipping.,Clothing (Brand),[sales@blazedwear.com],https://www.facebook.com/blazedwear/,754,https://www.instagram.com/blazedwear,Blazed Wear
196,https://gceyewear.com/,"408,290",眼鏡、太陽眼鏡與周邊、咖啡 - DGI系列｜只做好產品的品牌 - Geek Chic 宅時毛,Product/Service,[service@gceyewear.com],https://www.facebook.com/GCeyewear/,41424,https://www.instagram.com/gceyewear,GC eyewear
197,http://www.aquariumcoop.com,"408,710",Aquarium Co-Op is a freshwater fish store in the Seattle Washington area.,Pet Service,[store@aquariumcoop.com],https://www.facebook.com/AquariumCoOp/,21216,https://www.instagram.com/aquariumcoop,Aquarium Co-Op
198,http://www.klpolish.com,"409,010",KL Polish,Health/Beauty,,https://www.facebook.com/klpolish/,31579,https://www.instagram.com/klpolish,KL Polish
199,https://www.xpandlaces.com,"409,044","Shoelaces redesigned.  Comfort, style and performance all in one lacing system!",Clothing (Brand),,https://www.facebook.com/Xpandlaces/,28850,https://www.instagram.com/xpandlaces,Xpand Lacing System
200,http://www.yellowleafhammocks.com,"409,158","Ridiculously Comfy, Shockingly Soft, 100% Handwoven Hammocks. A social enterprise spreading joy + relaxation around the globe. Join Us!",Shopping & Retail,[hello@yellowleafhammocks.com],https://www.facebook.com/yellowleafhammocks/,5335,https://www.instagram.com/yellowleafhammocks,Yellow Leaf Hammocks
201,http://thesociallife.com/,"409,437",Premium Greek Apparel and Lifestyle,Clothing (Brand),[info@thesociallife.com],https://www.facebook.com/TheSocialLife/,21428,https://www.instagram.com/thesociallife,The Social Life
202,http://woolandprince.com,"409,900","Better, longer lasting apparel. 

www.woolandprince.com",Clothing (Brand),,https://www.facebook.com/WOOLandPRINCE/,5359,https://www.instagram.com/woolandprince,Wool&Prince
203,http://www.spoke-art.com,"410,650",Spoke Art,Art Gallery,[info@spoke-art.com],https://www.facebook.com/spokeart/,190643,https://www.instagram.com/spoke-art,Spoke Art
204,www.corkcicle.com,"410,810",We make things that cool.  We make cool things.,Product/Service,,https://www.facebook.com/Corkcicle/,254123,https://www.instagram.com/corkcicle,CORKCICLE
205,http://www.juguetron.mx,"411,054","Donde Viven los Juguetes
http://www.juguetron.mx/

También nos puedes seguir en:

Twitter       @JUGUETRON
Pinterest    pinterest.com/juguetron",Games/Toys,,https://www.facebook.com/Juguetron/,417400,https://www.instagram.com/juguetron,Juguetron
206,http://www.oliversapparel.com,"411,794",A fresh take on athletic apparel classics. ,Clothing (Brand),[contact@oliversapparel.com],https://www.facebook.com/OliversApparel/,12487,https://www.instagram.com/oliversapparel,Olivers Apparel
207,http://olaplex.com,"411,915",Bond Multiplier that dramatically eliminates breakage from chemical services and leaves hair feeling amazing!,Cosmetics Store,[info@olaplex.com],https://www.facebook.com/olaplex/,765225,https://www.instagram.com/olaplex,Olaplex
208,http://www.premieryarns.com,"412,074","Premier Yarns -- dedicated to making interesting, colorful, and fun yarns for your crafting projects!",Company,[info@premieryarns.com],https://www.facebook.com/PremierYarns/,14821,https://www.instagram.com/premieryarns,Premier Yarns
209,http://barbasandzacari.com,"412,649","Barbas & Zacári is an Australian born accessories label, specialising in providing the market with minimalist, stylish and affordable watches and eyewear.",Jewelry/Watches,,https://www.facebook.com/barbasandzacari/,16583,https://www.instagram.com/barbasandzacari,Barbas & Zacári
210,http://macys.com/americanrag,"413,215",For those who dare to make every moment authentically their own. Only at Macy’s.,Clothing (Brand),,https://www.facebook.com/americanrag/,453319,https://www.instagram.com/americanrag,American Rag
211,http://www.luckytacklebox.com,"413,386",We'll ship a box full of the BEST NEW BAITS right to your door every month! We've got a box for every species 100% Free US Shipping!,Outdoor & Sporting Goods Company,[support@luckytacklebox.com],https://www.facebook.com/LuckyTackleBox/,222899,https://www.instagram.com/luckytacklebox,Lucky Tackle Box
212,http://novanym.com,"413,413","Novanym is the smart way to name your business. We sell ready-made business names, each with a perfect, single word .com address and a choice of logos.",Local Business,[hello@novanym.com],https://www.facebook.com/novanym/,65,https://www.instagram.com/novanym,Novanym
213,http://rodengray.com,"413,452","The premier destination for designer men's clothing, footwear, and accessories. http://rodengray.com",Retail Company,[info@rodengray.com],https://www.facebook.com/rodengray/,4765,https://www.instagram.com/rodengray,Roden Gray
214,http://www.hotchocolatedesign.com,"413,705",Marca de Diseño Venezolano fundada en el año 2004 por Pablo Martínez y Carolina Aguerrevere.,Sports Event,[compras@hotchocolatedesign.com],https://www.facebook.com/HotChocolateDesign/,225610,https://www.instagram.com/hotchocolatedesign,Hot Chocolate
215,http://www.BioClarity.com,"413,813","Clean, green, never mean. With the smarts of science + power of plants, we help you find clear, natural balanced skin. 

Vegan + Cruelty-Free",Health/Beauty,[care@bioclarity.com],https://www.facebook.com/bioclarity/,18267,https://www.instagram.com/bioclarity,BioClarity
216,http://www.Ships-a-lot.com,"414,289",Fully bespoke order fulfillment for fast growing Ecommerce stores. ,E-commerce Website,[info@shipsalot.com],https://www.facebook.com/Shipsalot/,484,https://www.instagram.com/ships-a-lot,Ships-a-Lot
217,http://www.thebrubaker.com,"415,683","Nueva forma de crear Básicos, Esenciales y Accesorios, que sólo existe on line, saltando los intermediarios, a precios disruptivos. www.thebrubaker.com",Clothing (Brand),,https://www.facebook.com/TheBrubaker/,35169,https://www.instagram.com/thebrubaker,The Brubaker
218,https://www.threebirdnest.com,"417,311",Designing and hand selecting our clothing + boho jewelry collections Three Bird Nest delivers curated boho apparel + accessories to free spirited women.,Clothing (Brand),[hello@threebirdnest.com],https://www.facebook.com/threebirdnest/,603395,https://www.instagram.com/threebirdnest,Three Bird Nest
219,http://www.TheDesignersFoundry.com,"417,500",T D F — The Designers Foundry,Website,[hi@thedesignersfoundry.com],https://www.facebook.com/TheDesignersFoundry/,9354,https://www.instagram.com/thedesignersfoundry,The Designers Foundry
220,http://mineralfusion.com/ http://twitter.com/mineralfusion,"417,883",Enhance your skin with cruelty-free mineral products. Stunning pigments & soothing botanicals improve complexion & nourish skin. ,Cosmetics Store,,https://www.facebook.com/MineralFusion/,43682,https://www.instagram.com/mineralfusion,Mineral Fusion
221,http://www.eJuiceDirect.com,"418,226","eJuice Direct is an online discount vape shop. Offering a wide selection of premium ejuices, hardware and accessories at everyday low prices!",Shopping & Retail,[info@ejuicedirect.com],https://www.facebook.com/ejuicedirect/,3764,https://www.instagram.com/ejuicedirect,Ejuice Direct
222,http://www.offdutybasics.com,"418,292","www.OFFDUTYbasics.com
Get COZY. Feel OFF DUTY.
#getcozy",Health/Beauty,[cs@offdutyintimates.com],https://www.facebook.com/OFFDUTYbasics/,1072,https://www.instagram.com/offdutybasics,Off Duty Basics
223,https://www.livefashionable.com/,"418,477",LOCAL + GLOBAL // beautiful products by women who have overcome,Accessories,[support@livefashionable.com],https://www.facebook.com/livefashionABLE/,40222,https://www.instagram.com/livefashionable,FASHIONABLE
224,http://www.sagaouterwear.com,"418,598","Premium Outerwear Since 2005. More Fun, More Function. ",Clothing (Brand),[contact@sagaouterwear.com],https://www.facebook.com/sagaouterwear/,72394,https://www.instagram.com/sagaouterwear,Saga Outerwear
225,http://www.pixibeauty.com,"418,743","Flawless in a few fuss-free moments...Pixi's Mission.
http://www.pixibeauty.com",Health/Beauty,[info@pixibeauty.com],https://www.facebook.com/PixiBeauty/,287315,https://www.instagram.com/pixibeauty,Pixi Beauty
226,"http://www.savvywatch.com
http://twitter.com/SavvyWatch","418,777","Authentic watches from favorite brands like Michael Kors, Armani, Hamilton, Marc by Marc Jacobs, Nixon and more. 
Follow us on Instagram! @Savvy_Watch",Jewelry/Watches,,https://www.facebook.com/savvywatch/,937,https://www.instagram.com/savvywatch,Savvy Watch
227,,"418,877",BUY a CHEAP League of Legends or Pokemon Go accounts on Popular Game Accounts NOW! We have huge selection of POGO & LOL Accounts. ,Brand,,https://www.facebook.com/PopularGameAccounts/,91893,https://www.instagram.com/populargameaccounts,Popular Game Accounts
228,http://www.freewalkco.com,"419,010","FREEWALK TO FREEDOM
Nuestro know-how es uno de nuestros valores más importantes, por eso ofrecemos gafas de sol de gran calidad, a precio más que razonable",Clothing (Brand),[frewalkco@gmail.com],https://www.facebook.com/freewalkco/,6709,https://www.instagram.com/freewalkco,FREEWALK
229,http://www.ornamic.com,"419,345","Ornamic | Shop Rug, Furniture, Art, Decor, Lighting & More",Home Decor,[support@ornamic.com],https://www.facebook.com/ornamic/,98,https://www.instagram.com/ornamic,Ornamic
230,www.virusintl.com,"419,446",VIRUS | The passion that defines you.,Sportswear Store,[customerservice@virusintl.com],https://www.facebook.com/VirusIntl/,31442,https://www.instagram.com/virusintl,Virus | Action Sport Performance
231,http://www.rightchannelradios.com/,"420,118","We specialize in CB equipment for Trucks, 4x4's, and Commercial vehicles and provide outstanding service. Visit us at www.RightChannelRadios.com.",Sports & Recreation,[http://www.rightchannelradios.com/contact-us-form],https://www.facebook.com/RightChannelRadios/,2725,https://www.instagram.com/rightchannelradios,Right Channel Radios
232,http://www.worldofwool.co.uk,"420,951",A World of Wool at Your Fingertips!,Arts & Crafts Store,[info@worldofwool.co.uk],https://www.facebook.com/worldofwool/,6476,https://www.instagram.com/worldofwool,World of Wool
233,http://www.southernmarsh.com,"421,349","The Original Southern Outfitter
High-quality clothing for Men, Women and Youth
http://www.southernmarsh.com",Clothing (Brand),,https://www.facebook.com/southernmarsh/,310949,https://www.instagram.com/southernmarsh,Southern Marsh Collection
234,,"421,437",Ellen Shop,Product/Service,[jinglixu6@gmail.com],https://www.facebook.com/EllenShop/,17,https://www.instagram.com/ellenshop,Ellen Shop
235,http://www.AmericanButtonMachines.com,"421,609","American Button Machines is your one-stop button machine shop, with button making machines and accessories available for any occasion or craft project. Visit our website at www.AmericanButtonMachines.com or feel free to phone us at 972-985-5074.",Arts & Crafts Store,,https://www.facebook.com/AmericanButtonMachines/,3320,https://www.instagram.com/americanbuttonmachines,American Button Machines
236,http://www.instagram.com/svaccessories,"421,738","Accessories that make a difference.

Finos accesorios hechos a mano, con piedras naturales y chapeados de 18 k. ",Jewelry/Watches,,https://www.facebook.com/savageaccessories/,197,https://www.instagram.com/savageaccessories,SAVAGE
237,http://www.BeatMakingBeats.com,"422,143","MUSIC PRODUCERS - Check Out This Website:

http://www.BeatMakingBeats.com

For Your FREE Copy Of 'Red Carpet' The Producer Drum Kits Collection!

*",Product/Service,,https://www.facebook.com/HipHopDrumSamples/,1003,https://www.instagram.com/hiphopdrumsamples,FREE Hip Hop Producer Drum Kits Collection
238,"http://www.monstersteel.com, http://twitter.com/monstersteel","422,967","Monster Steel is dedicated to providing quality tattoo equipment, piercing supplies, and body jewelry.
Customer Service: 1-800-630-9256",Accessories,[social@monstersteel.com],https://www.facebook.com/Monstersteel/,9516,https://www.instagram.com/monstersteel,Monstersteel
239,http://www.nicotineriver.com,"423,200","Wholesale distributor of premium Nicselect liquid nicotine, USP Kosher propylene glycol and vegetable glycerin.",Wholesale & Supply Store,[info@nicotineriver.com],https://www.facebook.com/nicotineriver/,2068,https://www.instagram.com/nicotineriver,Nicotine River
240,http://fatbeats.com ,"423,268","Established in 1994, we've grown from a small NYC basement store to a worldwide brand. ",Record Label,[orders@fatbeats.com],https://www.facebook.com/fatbeats/,28784,https://www.instagram.com/fatbeats,Fat Beats
241,https://www.facebook.com/sixpackshop/,"423,707",sixpackshop จำหน่ายชุดออกกำลังกาย ชุดฟิตเนส ชุดกีฬา ชุดโยคะ ราคาถูก คุณภาพดี,Sportswear Store,,https://www.facebook.com/sixpackshop/,104,https://www.instagram.com/sixpackshop,Sixpack - ชุดออกกำลังกาย ชุดฟิตเนส ชุดกีฬา ราคาถูก คุณภาพดี
242,https://www.maydaygames.com/,"424,931","Family games, card sleeves, and board game accessories. Check us out at https://www.maydaygames.com",Game Publisher,[support@maydaygames.com],https://www.facebook.com/maydaygames/,7285,https://www.instagram.com/maydaygames,Mayday Games
243,http://www.sassyassyclubwear.com,"425,296",Women's club wear ,Clothing (Brand),,https://www.facebook.com/SassyAssyClubwear/,1720,https://www.instagram.com/sassyassyclubwear,Sassy Assy Clubwear
244,https://laurenmoshi.com ,"425,415"," High Quality Designer Women's Clothing, Kidswear & Art",Clothing (Brand),[customerservice@laurenmoshi.com],https://www.facebook.com/LaurenMoshi/,17912,https://www.instagram.com/laurenmoshi,Lauren Moshi
245,http://www.leifshop.com,"425,442",LEIF / goods for living / www.leifshop.com,Gift Shop,[hello@leifshop.com],https://www.facebook.com/leifshop/,9180,https://www.instagram.com/leifshop,LEIF
246,http://www.bhbreptiles.com ,"425,915","Our slogan here at BHB is ""Covering the Spectrum"" and that's how our collection has been built. This approach has lead us to work with a very wide variety of snakes.Store site http://www.bhbreptiles.com Email bhbent@sbcglobal.net",Pet Breeder,[lori@bhbreptiles.com],https://www.facebook.com/BHBReptiles/,181587,https://www.instagram.com/bhbreptiles,BHB Reptiles
247,http://dndfdirect.com,"425,934","DNDFDIRECT.COM is a Family run business located in upstate New York, with over 20 years of experience in the vitamin & Sport Supplement industry.",Health & Wellness Website,[sales@dndfdirect.com],https://www.facebook.com/DNDFDirect/,377,https://www.instagram.com/dndfdirect,DNDFDirect.com
248,http://ElectroThreads.com,"426,325","LifeStyle Clothing all about positive vibes!
Brightening the world one shirt at a time!!!
Shop now >>> http://ElectroThreads.com
",Clothing (Brand),[help@electrothreads.com],https://www.facebook.com/ElectroThreads/,2481442,https://www.instagram.com/electrothreads,Electro Threads
249,http://obeythekorean.net,"426,421","http://obeythekorean.net
KPOP Phone case SHOP.",Company,[obeythekorean@hotmail.com],https://www.facebook.com/obeythekorean/,15102,https://www.instagram.com/obeythekorean,OBEYTHEKOREAN
250,www.liverpooluniversitypress.co.uk,"426,609","Liverpool University Press (LUP) is the UK’s third oldest university press. We publish approximately 100 books a year and 28 journals, specialising in literature, modern languages, history and visual culture.",Publisher,[lup@liverpool.ac.uk],https://www.facebook.com/liverpooluniversitypress/,113,https://www.instagram.com/liverpooluniversitypress,Liverpool University Press
251,http://www.makeupmekka.no,"426,637","Gjelder det betaling: ta kontakt med Klarna på telefon 21 01 89 91.
Andre henvendelser: send mail til kundeservice@makeupmekka.no",Health/Beauty,[kundeservice@makeupmekka.no],https://www.facebook.com/makeupmekka/,120016,https://www.instagram.com/makeupmekka,Makeup Mekka
252,http://www.bvaccel.com,"426,892",Brand Value is Born in Results.,Web Designer,[agency@bvaccel.com],https://www.facebook.com/BVAccel/,4055,https://www.instagram.com/bvaccel,Brand Value Accelerator llc
253,www.martview.com,"427,042",If you are a eBay/Amazon seller this is the right place for you .But we wholesales through online channel with small order ,Retail Company,[marc@martview.com],https://www.facebook.com/martview/,101242,https://www.instagram.com/martview,MartView™
254,hukgear.com,"427,158",Anglers are united by a single piece of equipment: the Huk. Huk performance apparel unites all anglers regardless of their pursuit. ,Outdoor & Sporting Goods Company,,https://www.facebook.com/HukGear/,344175,https://www.instagram.com/hukgear,Huk Gear
255,www.littlebirdelectronics.com,"427,577","Service Powered Electronics from Maddy & Marcus! Little Bird Electronics provides fast shipping of Arduino, Electronic Kits, Components, Semiconductors, Enclosures, Batteries & Chargers, Power Supplies, Tools and more!",Computers & Internet Website,,https://www.facebook.com/littlebirdelectronics/,6955,https://www.instagram.com/littlebirdelectronics,Little Bird Electronics
256,http://veppocig.com ,"428,234",http://veppocig.com Personal vaporizers and e-cigars that allow you to enjoy the sense of satisfaction you can't get from anywhere else. ,E-Cigarette Store,[info@veppocig.com],https://www.facebook.com/VeppoCig/,3737,https://www.instagram.com/veppocig,Veppo Vape Shop
257,www.combatflipflops.com,"428,497","BAD FOR RUNNING, WORSE FOR FIGHTING",Shopping & Retail,[info@combatflipflops.com],https://www.facebook.com/combatflipflops/,67195,https://www.instagram.com/combatflipflops,Combat Flip Flops
258,http://hobbiesdiscount.net,"428,767","We sell high-quality, discount Hobby supplies.",Advertising/Marketing,,https://www.facebook.com/HobbiesDiscount/,340423,https://www.instagram.com/hobbiesdiscount,Hobbies Discount
259,http://www.irenesstory.com/,"428,805",,Shopping & Retail,[order@irenesstory.com],https://www.facebook.com/IrenesStory/,27950,https://www.instagram.com/irenesstory,Irene's Story
260,http://3diosound.com,"429,005",Manufacturer of the professional binaural microphones.,Electronics,[customercare@3diosound.com],https://www.facebook.com/3diosound/,1359,https://www.instagram.com/3diosound,3Dio
261,,"429,133","G-Easy Store ���
Moda Masculina.
Moda Feminina.
Não possuímos loja física �
SAC: � (12) 99640-0762, � (12)981061477. Enviamos para todo Brasil �",Clothing Store,,https://www.facebook.com/geazystore/,489,https://www.instagram.com/g-eazystore,G-Easy Store
262,,"429,225",Boost Heaven,Community,,https://www.facebook.com/BoostHeaven/,377,https://www.instagram.com/boost-heaven,Boost Heaven
263,http://www.arcadiamovement.com,"429,692","Modern and refined Activewear for the land and sea //
Byron Bay
@arcadia_movement
Debut collection instore and online now
",Clothing (Brand),,https://www.facebook.com/arcadiamovement/,712,https://www.instagram.com/arcadiamovement,Arcadia Movement
264,www.choiceslides.com,"429,712","Graphic Design for Slide Shows
www.choiceslides.com",Entertainment Website,[choiceslides@gmail.com],https://www.facebook.com/ChoiceSlides/,1822,https://www.instagram.com/choiceslides,Choice Slides
265,http://www.aduna.ro,"429,830","ADUNA.ro - cel mai generos site de cashback din Romania!
Cum functioneaza: http://bit.ly/1kCIP2b
Înregistrare: http://bit.ly/Rr4Jeq",Website,[info@aduna.ro],https://www.facebook.com/aduna/,25958,https://www.instagram.com/aduna,ADUNA.ro
266,http://shoreprojects.com,"429,866",Started by a group of friends who one day noticed that none of them actually wore watches: www.shoreprojects.com,Jewelry/Watches,,https://www.facebook.com/ShoreProjects/,23544,https://www.instagram.com/shoreprojects,Shore Projects
267,https://www.groundzeroprecision.com,"429,974",Your online source for high quality AR-15 parts and components. ,Machine Shop,[customerservice@blaminc.com],https://www.facebook.com/GroundZeroPrecision/,17769,https://www.instagram.com/groundzeroprecision,Ground Zero Precision
268,http://www.RaceDayQuads.com,"430,950",Run by pilots for pilots - for all your racing needs look no further than RDQ.,Shopping & Retail,[racedayquads@gmail.com],https://www.facebook.com/RaceDayQuads/,3329,https://www.instagram.com/racedayquads,RaceDayQuads
269,http://www.ShopDressUp.com,"431,643","We have 20 locations for you to visit, or you can shop with us online at ShopDressUp.com. We get in over 65+ new, trendy and affordable styles weekly!",Women's Clothing Store,[info@shopdressup.com],https://www.facebook.com/ShopDressUp/,297795,https://www.instagram.com/shopdressup,Dress Up
270,https://www.facebook.com/lot33,"431,678","《消費介紹》
Live House 
個人最低消費
平日：週一~週四$320
假日：週五~週六$420
均加一成歌手演出費
訂位專線:07-2219068、07-2213238",Wine Bar,[lot33168@yahoo.com.tw],https://www.facebook.com/lot33/,10665,https://www.instagram.com/lot33,樂三三音樂餐廳
271,http://www.medievaldepot.com,"431,983","Medieval Depot Carries a wide variety of products (swords, shields, medieval items, knives,etc.) from movies, video games and anime. ",Outdoor Equipment Store,,https://www.facebook.com/MedievalDepot/,572,https://www.instagram.com/medievaldepot,Medieval Depot
272,http://www.condorcycles.com,"432,462","Established in 1948 Condor Cycles manufactures bicycles, frames and accessories for all types of rider. ",Bicycle Shop,[customer.service@condorcycles.com],https://www.facebook.com/condorcycles/,4810,https://www.instagram.com/condorcycles,Condor Cycles
273,https://kollectionk.com,"432,736",Discover the latest Korean beauty trend at KollectionK. Explore the newest Korean cosmetics including cheap Korean makeup and skin care products.,Website,[help@kollectionk.com],https://www.facebook.com/kollectionk/,16850,https://www.instagram.com/kollectionk,KollectionK
274,http://www.besamecosmetics.com,"433,184","Visit Our Store! 

Besame Burbank
3505 West Magnolia Blvd. Burbank CA 91505",Cosmetics Store,[info@besamecosmetics.com],https://www.facebook.com/BesameCosmetics/,70571,https://www.instagram.com/besamecosmetics,Besame Cosmetics
275,http://abc.go.com/shows/shark-tank,"433,934","The official page for Shark Tank. Season premiere on a new day, Oct 1 at 9|8c on ABC!",TV Show,,https://www.facebook.com/SharkTank/,1512286,https://www.instagram.com/sharktank,Shark Tank
276,,"434,178","On Point Looks was created with the vision to deliver high-quality products focused on beauty, grooming, and wellness. Our team is directly involved in sou",Health/Beauty,,https://www.facebook.com/OnPointLooks/,4142,https://www.instagram.com/onpointlooks,On Point Looks
277,http://www.standoutcvservices.com/,"434,182","Friendly CV/Linkedin Profile Writer & Motivational Job Hunting Coach.

",Writing Service,[standoutcv@hotmail.com],https://www.facebook.com/StandOutCV/,1503,https://www.instagram.com/standout-cv,Stand Out CV & Linkedin Services
278,http://www.contentbeautywellbeing.com,"434,490","'London's leading organic and natural apothecary'.    Instyle Magazine - 'Top 50 Style Sites you must Bookmark, 2010'. Daily Candy - Sweetest Thing Nominee 2009. Wallpaper Magazine - Best Facial 2009",Skin Care Service,[help@beingcontent.com],https://www.facebook.com/ContentBeautyWellbeing/,6535,https://www.instagram.com/contentbeautywellbeing,Content Beauty/Wellbeing
