,Link,Ranking,about,category,email,facebook page,facebook subscribers,instagram Url,name
370,www.carraigdonn.com,"462,923","Carraig Donn is Ireland’s premier retailer of Fashion, Jewellery & Gifts with 38 stores nationwide and online at www.carraigdonn.com",Retail Company,[customerservice@carraigdonn.com],https://www.facebook.com/CarraigDonn/,92928,https://www.instagram.com/carraigdonn,Carraig Donn
371,http://www.KREWE.com,"464,078","We are a New Orleans-based and culturally inspired independent eyewear company celebrating individual style with modern, iconic frames.",Accessories,[krewe@krewe.com],https://www.facebook.com/KREWE/,27263,https://www.instagram.com/krewe,KREWE
372,http://www.ezscreenprint.com,"464,112","EZScreen Stencils are a user-friendly product for creating custom silk-screen stencils to use on fabric, metal, wood, paper, glass ceramic and so much more",Screen Printing & Embroidery,[contactus@ezscreenprint.com],https://www.facebook.com/EZScreenPrint/,1495,https://www.instagram.com/ezscreenprint,EZScreenPrint
373,"http://butikk.samlaget.no, www.samlaget.no, instagram.com/detnorskesamlaget, http://www.youtube.com/user/DetNorskeSamlaget, www.twitter.com/samlaget","464,548","Vi gir ut kvalitetslitteratur på nynorsk, for barn og vaksne",Publisher,,https://www.facebook.com/samlaget/,11231,https://www.instagram.com/samlaget,Det Norske Samlaget
374,http://crailstore.com,"464,626","One-stop shop for Girl Skateboards, Chocolate Skateboards, Royal Trucks and Pretty Sweet gear.",Clothing Store,,https://www.facebook.com/crailstore/,8,https://www.instagram.com/crailstore,Crailstore
375,,"465,005","An eclectic collection of handcrafted lovelies to adorn your home. Modern wall hangings for your front door or living room wall. 
Pictou County, NS.",Art,,https://www.facebook.com/localeclectic/,70,https://www.instagram.com/localeclectic,Local Eclectic Nova Scotia
376,https://www.pawprime.com/,"465,425","Welcome to Paw Prime
At PawPrime We Create Stuff To Make All Dogs Happy & Safe!
Happy Tail Guarantee!
WorldWide Shipping
#alldogsmatter",Sports Club,[support@pawprime.com],https://www.facebook.com/pawprime/,123000,https://www.instagram.com/pawprime,Dog Love
377,http://www.retroactivesmokeshop.com,"465,641",Retro Active offers a huge selection of adult smoking products and accessories with 3 locations in Missouri and an online store. ,Tobacco Store,[contact@retroactivesmokeshop.com],https://www.facebook.com/retroactivesmokeshop/,1447,https://www.instagram.com/retroactivesmokeshop,Retro Active Smoke Shop
378,http://www.fitvinewine.com,"465,880",We Crush Grapes You Crush Life,Wine/Spirits,,https://www.facebook.com/FitVineWine/,118920,https://www.instagram.com/fitvinewine,FitVine Wine
379,http://www.whatisblik.com,"466,035","What is Blik? The leading designer and maker of innovative self-adhesive surface graphics. Always removable, sometimes re-stikable and guaranteed to make your walls rock.  http://www.whatisblik.com/ http://www.whatisblik.com/blog/",Home Decor,,https://www.facebook.com/whatisblik/,45229,https://www.instagram.com/whatisblik,blik surface graphics
380,http://www.PureTrak.com,"466,317",The world's new leading developer of innovative and professional gaming gear.,Product/Service,[sales@puretrak.com],https://www.facebook.com/puretrak/,3754,https://www.instagram.com/puretrak,PureTrak
381,http://www.geniuspipe.com,"466,384","Few facts about Genius Pipe:
Cough-less
Water-less
Lifetime warranty
100% Money back guarantee
More @ http://GeniusPipe.com",Community,,https://www.facebook.com/geniuspipe/,41672,https://www.instagram.com/geniuspipe,GeniusPipe
382,http://www.microphonelens.com,"466,885",Mobile Microscopy. Making microscopes accessible one lens at a time.,Company,,https://www.facebook.com/MicroPhoneLens/,2655,https://www.instagram.com/microphonelens,Micro Phone Lens
383,,"466,897",,Event Planner,,https://www.facebook.com/yemoos/,85,https://www.instagram.com/yemoos,Yemoos Catering and Floral Deco
384,www.geekchichq.com,"467,108",Heirloom quality hardwood furniture. Handcrafted by geeks in the USA.,Furniture,[sales@geekchichq.com],https://www.facebook.com/GeekChicHQ/,17730,https://www.instagram.com/geekchichq,Geek Chic
385,http://www.filastruder.com http://www.soliforum.com/forum/18/filastruder/ https://twitter.com/Filastruder http://www.kickstarter.com/projects/833191773/filastruder-a-robust-inexpensive-filament-extruder,"467,417","Our goal is simply to provide access to products that make at-home 3D printing less expensive and less frustrating, so you can spend more time tinkering.",Tools/Equipment,[support@filastruder.com],https://www.facebook.com/Filastruder/,1038,https://www.instagram.com/filastruder,Filastruder
386,http://www.damascusapparel.com ,"467,440",Creators Unite | The People of Silk and Steel,Fashion Designer,[nate@damascusapparel.com],https://www.facebook.com/damascusapparel/,139038,https://www.instagram.com/damascusapparel,Damascus
387,www.clae.com,"467,508",www.clae.com | www.twitter.com/clae_footwear ,Clothing (Brand),,https://www.facebook.com/clae/,31184,https://www.instagram.com/clae,CLAE
388,https://pixellogo.com,"468,534","Creative Logo Design Solution provider.

Vist us on www.pixellogo.com",Product/Service,[sales@pixellogo.com],https://www.facebook.com/pixellogo/,2233,https://www.instagram.com/pixellogo,LogoDive
389,https://www.leesa.com/products/sapira-mattress,"468,713","Sapira by Leesa can now be found at @leesasleep!

The Sapira mattress is the first luxury pocket spring and performance foam mattress delivered to your home in a box, at a surprisingly low price.",Furniture,,https://www.facebook.com/sapirasleep/,5024,https://www.instagram.com/sapirasleep,Sapira by Leesa
390,,"469,030","Moda para o dia a dia tem que ter estilo, tem que ser confortável e acessível. Essa é a idéia, esse é o conceito, essa é a Alpha Clothing! ",Clothing Store,[contato@usealpha.com.br],https://www.facebook.com/alphaclothing/,2705,https://www.instagram.com/alphaclothing,Alpha Clothing
391,www.satyajewelry.com,"470,128","Handcrafted jewelry and lifestyle label. Created in New York. Inspired by the world.
Follow us on Twitter & Instagram at @SatyaJewelry  
",Jewelry/Watches,,https://www.facebook.com/satyajewelry/,42120,https://www.instagram.com/satyajewelry,Satya Jewelry
392,,"470,748","Thời trang túi xách, mỹ phẩm với giá cả phải chăng.. mọi người ủng hộ nha...sdt liên hệ: 0914 450 779",Women's Clothing Store,,https://www.facebook.com/QuinnShop/,816,https://www.instagram.com/quinnshop,Quinn Shop
393,http://www.prxperformance.com,"470,837",PRx Performance is the pioneer and world leader in the manufacturing and distribution of space-saving fitness equipment.,Sporting Goods Store,[support@prxperformance.com],https://www.facebook.com/PRxPerformance/,84480,https://www.instagram.com/prxperformance,PRx Performance
394,http://edocollections.com,"471,033",Curated Artisan Collections. Affordable Prices. Free Worldwide Shipping. Shop Now!,Jewelry/Watches,,https://www.facebook.com/EDOCollections/,9824,https://www.instagram.com/edocollections,EDO Collections
395,http://www.lifeboostcoffee.com,"471,245","Life Boost Coffee is a Premium, Organic, Single Origin Coffee Company Based On Integrity, Honesty & Elevating Others.",Health/Beauty,[support@lifeboostcoffee.com],https://www.facebook.com/lifeboostcoffee/,46597,https://www.instagram.com/lifeboostcoffee,LifeBoost Coffee
396,http://www.tepuitents.com,"472,554",Tepui roof top tents are made with the most durable all-weather materials that will stand up to the most extreme conditions.  ,Outdoor Equipment Store,[beth@tepuitents.com],https://www.facebook.com/tepuitents/,40588,https://www.instagram.com/tepuitents,Tepui Tents
397,http://www.hyperbiotics.com,"472,595","GUT HEALTH ➕ CLEAN LIVING || Probiotics for the whole family || To learn more, visit www.hyperbiotics.com

",Health/Beauty,[contact@hyperbiotics.com],https://www.facebook.com/hyperbiotics/,60251,https://www.instagram.com/hyperbiotics,Hyperbiotics
398,http://www.victoryvape.com.au,"472,752",Victory Vape can supply all your needs to successfully join the vaping revolution!,Shopping & Retail,[info@victoryvape.com.au],https://www.facebook.com/victoryvape/,4146,https://www.instagram.com/victoryvape,Victory Vape
399,http://www.luxurygaragesale.com,"472,753","LGS is a designer consignment brand bringing you stand-out, authentic new and vintage pieces",Retail Company,[info@luxurygaragesale.com],https://www.facebook.com/LuxuryGarageSale/,12120,https://www.instagram.com/luxurygaragesale,Luxury Garage Sale
400,http://www.minimaterials.com,"472,986",The finest made miniature construction material. We specialize in miniature cinder blocks and miniature pallet coasters. www.minimaterials.com,Retail Company,[info@minimaterials.com],https://www.facebook.com/minimaterials/,2983,https://www.instagram.com/minimaterials,Mini Materials
401,http://www.gentrynyc.com/,"474,209","108 N 7th Street 
Brooklyn, NY 11249

Please visit us at:
www.gentrynyc.com

Phone: +1.718.384.8588",Footwear Store,[info@gentrynyc.com],https://www.facebook.com/Gentrynyc/,52757,https://www.instagram.com/gentrynyc,Gentry
402,http://www.minishopmadrid.com/,"474,505","ACNE STUDIOS, RAF SIMONS, COMME DES GARÇONS, PLAY COMME DES GARÇONS, J.W. ANDERSON, LEVIS VINTAGE CLOTHING, SATISFY, OUR LEGACY, YEEZY, ADIDAS, NIKE ...",Accessories,[mini04shop@yahoo.com],https://www.facebook.com/minishopmadrid/,2417,https://www.instagram.com/minishopmadrid,Mini Shop
403,https://www.knitting-warehouse.com,"475,191","Knitting-Warehouse.com is your best source on the web for discount yarn, knitting and crochet supplies. Over 8,500 yarn, knitting and crochet products.",Retail Company,[customerservice@knitting-warehouse.com],https://www.facebook.com/knittingwarehouse/,861,https://www.instagram.com/knitting-warehouse,Knitting-Warehouse
404,http://www.jamstik.com/,"475,537","Jamstik+ is a portable, wireless SmartGuitar for iOS and Android.

Order today at jamstik.com or Amazon http://amzn.to/1i1TNjJ

For support, please visit: http://bit.ly/jamstiksupport

",Electronics,,https://www.facebook.com/JamStik/,61435,https://www.instagram.com/jamstik,jamstik
405,http://www.mmawarehouse.com,"475,960",Follow us twitter.com/mmawarehouse,Retail Company,,https://www.facebook.com/mmawarehouse/,99542,https://www.instagram.com/mmawarehouse,MMAWarehouse.com
406,http://www.bedjet.com,"476,204","Cooling, heating and climate control system made just for your bed.  Find your perfect sleep temperature.  www.bedjet.com   ",Appliances,[info@bedjet.com],https://www.facebook.com/bedjet/,7662,https://www.instagram.com/bedjet,BedJet
407,http://www.bingbangnyc.com ,"476,340",www.bingbangnyc.com,Jewelry & Watches Store,[customerservice@bingbangnyc.com],https://www.facebook.com/bingbangnyc/,19453,https://www.instagram.com/bingbangnyc,Bing Bang NYC
408,,"476,603",We offer the most popular items on the internet at the best bargain prices.,Website,,https://www.facebook.com/superninjabargains/,6,https://www.instagram.com/superninjabargains,Superninjabargains
409,www.rudysbarbershop.com,"476,645",Rudy's has been the authority on effortless style since 1993,Product/Service,[info@rudysbarbershop.com],https://www.facebook.com/rudysbarbershop/,23055,https://www.instagram.com/rudysbarbershop,Rudy's
410,http://www.lehighdefense.com,"476,988",Lehigh Defense specializes in the development and production of products for the ammunition and firearms industries. Our products and services range from the most innovative ammunition and projectiles in the industry to contract manufacturing services. ,Metal Fabricator,[sales@lehighdefense.com],https://www.facebook.com/LehighDefense/,13229,https://www.instagram.com/lehighdefense,"Lehigh Defense, LLC"
411,,"477,598","The Take Down Shop specializing in the proper removal of hair braids, extensions, and sew-ins. The maintenance and promotion of natural hair care. ",Hair Salon,,https://www.facebook.com/takedownshop/,1,https://www.instagram.com/takedownshop,Transitions Salon
412,http://www.loungeunderwear.com,"477,860",,Clothing (Brand),[info@loungeunderwear.com],https://www.facebook.com/loungeunderwear/,125010,https://www.instagram.com/loungeunderwear,Lounge Underwear
413,http://urbancrews.com/,"477,979","Instagram: @urbancrews
Google+: urbancrewsco",Clothing (Brand),,https://www.facebook.com/urbancrews/,42483,https://www.instagram.com/urbancrews,URBANCREWS
414,http://patronofthenew.us,"478,128",,Clothing Store,,https://www.facebook.com/patronofthenew/,7969,https://www.instagram.com/patronofthenew,Patron of the New
415,http://fydgetspinner.com,"478,172","Fidget Spinners the new device to alleviate the symptoms of stress ADD/ADHD, lack of concentration and bad habits.",Office Supplies,[info@fydgetspinner.com],https://www.facebook.com/fydgetspinner/,3046,https://www.instagram.com/fydgetspinner,FydgetSpinner
416,http://barefootprovisions.com,"478,360",The Best Paleo Food Online! We strive to be your trusted source for consciously curated paleo and primal foodstuffs. Worldwide Shipping. No membership fees. Whole30 Collection. ,Health Food Store,[hello@barefootprovisions.com],https://www.facebook.com/BarefootProvisions/,25410,https://www.instagram.com/barefootprovisions,Barefoot Provisions
417,www.cbcindustries.com,"478,650","CBC Industries provides high quality AR-15 rifles, AR-15 upper receiver assemblies, AR-15 barrels, parts, and accessories for the enthusiast.",Retail Company,[sales@cbcindustries.com],https://www.facebook.com/cbcindustries/,9289,https://www.instagram.com/cbcindustries,CBC Industries
418,http://www.MyShopPuppyLove.com,"478,725",For anyone who absolutely loves their pets!,Company,,https://www.facebook.com/shoppuppylove/,310,https://www.instagram.com/shoppuppylove,Shop Puppy Love
419,http://www.flashsteals.com,"478,741","Providing the best of deals, and savings up to 95% off retail on products you love.
Save today: www.flashsteals.com",Website,,https://www.facebook.com/FlashSteals/,43070,https://www.instagram.com/flashsteals,FlashSteals.com
420,http://Dabadovaporizers.com,"479,118","Leading in the innovation of dab technology.

Denver, CO

SNAPCHAT: Dabadodabs ",Product/Service,,https://www.facebook.com/dabadovaporizers/,52469,https://www.instagram.com/dabadovaporizers,Dabado
421,http://www.canyouhandlebar.com http://www.pinterest.com/canyouhandlebar/ http://twitter.com/canyouhandlebar/,"479,186","Can You Handlebar has been making some of the finest beard and moustache products on the market since 2012. Handcrafted using natural ingredients with an attention to detail in both the products and their packaging, and proudly made in the USA.",Health/Beauty,[question@canyouhandlebar.com],https://www.facebook.com/CanYouHandlebar/,10577,https://www.instagram.com/canyouhandlebar,CanYouHandlebar
422,,"479,235","Graphic Designer & Video Producer 
+212// 06.44.30.78.55
Mohammed TARRAQ
C O N T A C T - M E !! ",Artist,[heroartz@hotmail.fr],https://www.facebook.com/Hero.Arts/,2361,https://www.instagram.com/heroarts,M.Tarraq Artworks
423,http://www.clockura.com,"479,849",En Clockura nos apasionan los relojes . Por eso buscamos relojes por todo el mundo y te los ofrecemos a precios que consideremos razonables.,Website,,https://www.facebook.com/clockura/,7239,https://www.instagram.com/clockura,Clockura
424,http://punkcase.com/,"480,049",The ultimate protection for your mobile phone against you and mother nature,Private Members Club,[justask@punkcase.com],https://www.facebook.com/punkcase/,243931,https://www.instagram.com/punkcase,Punk Case
425,http://www.gatomall.com,"480,848","We're a online store bringing you hydrate, travel and fashion products around the world.",Shopping & Retail,[enquiry@gatomall.com],https://www.facebook.com/gatomall/,1106,https://www.instagram.com/gatomall,GatoMALL
426,http://www.alegriashoes.com,"480,914","The Official Alegria Shoes Facebook Page! Bringing you the latest Alegria News, Photos, Contests and more!",Product/Service,,https://www.facebook.com/alegriashoes/,199039,https://www.instagram.com/alegriashoes,Alegria Shoes
427,http://www.BoredParacord.com,"481,211",Paracord and a Little Bit More,Outdoor & Sporting Goods Company,[boredparacord@gmail.com],https://www.facebook.com/BoredParacord/,20691,https://www.instagram.com/boredparacord,Boredparacord.com
428,http://www.furlscrochet.com,"481,270",Craft in luxury. Visit fiberarts paradise at www.furlscrochet.com,Product/Service,[info@furlscrochet.com],https://www.facebook.com/furlscrochet/,67076,https://www.instagram.com/furlscrochet,Furls Crochet
429,http://matadorup.com/,"481,505",Ultralight packable adventure gear. Put yourself out there.,Shopping & Retail,[customerservice@matadorup.com],https://www.facebook.com/MatadorUp/,9651,https://www.instagram.com/matadorup,Matador
430,http://www.mayoreototal.mx,"481,918","Mayoreo de Abarrotes ofrecemos Precio, Entrega y Servicio.Haz tu pedido Ahora! Dale LIKE para recibir PROMOCIONES.",Retail Company,[informes@mayoreototal.com],https://www.facebook.com/mayoreototal/,6949,https://www.instagram.com/mayoreototal,MayoreoTotal.com
431,https://www.TextualTees.com,"482,359","LIKE US for a chance to win a FREE T-SHIRT.  Huge Selection, Same Day Shipping. ",Clothing (Brand),,https://www.facebook.com/TextualTees/,69464,https://www.instagram.com/textualtees,Textual Tees
432,http://www.inkwellpress.com,"482,483","Educating, encouraging and empowering women to create happier lives through organization & productivity.

",Retail Company,[hello@inkwellpress.com],https://www.facebook.com/inkwellpress/,35700,https://www.instagram.com/inkwellpress,Inkwell Press
433,www.monkeyfabrik.com,"482,862",MoneyFabrik est une boutique spécialisée dans les objets Malins.,Website,[info@monkeyfabrik.com],https://www.facebook.com/monkeyfabrik/,18501,https://www.instagram.com/monkeyfabrik,Monkey Fabrik
434,http://www.VikingMerch.com,"482,937","Check out www.VikingMerch.com for high quality Viking Merchandise!
Shop for Viking Jewelry, T-shirts, Drinking and Blowing Horns and more! 
",Company,[info@vikingmerch.com],https://www.facebook.com/VikingMerch/,188020,https://www.instagram.com/vikingmerch,Viking Merch
435,http://hbnbm.com,"482,960",The best mix of Music and Video Games on the Internet.,Website,[tips@hbnbm.com],https://www.facebook.com/HBnBM/,12529,https://www.instagram.com/hbnbm,Headbang 'n Buttonmash
436,http://www.mentorbox.in,"483,911",Why to decide blindly? See it all before you choose. Mentor Box connects you to the right mentor to take you to your dream education and career.,Education,,https://www.facebook.com/mentorbox/,1326,https://www.instagram.com/mentorbox,Mentor Box
437,http://www.alalastyle.com,"483,984","Alala is a luxury women's activewear line with clothing for running, spinning, yoga, working out and hanging out around town. 
http://alalastyle.com",Clothing (Brand),[service@alalastyle.com],https://www.facebook.com/alalastyle/,7031,https://www.instagram.com/alalastyle,Alala
438,http://www.cimetrics.com,"484,603",High-tech energy efficiency products and services for commercial and institutional buildings.,Energy Company,[info@cimetrics.com],https://www.facebook.com/cimetrics/,92,https://www.instagram.com/cimetrics,Cimetrics
439,http://blueingreensoho.com/,"485,438",a Soho NYC men's select clothing shop and exclusive agent & distributor of the finest imported Japanese raw selvage denim jeans,Men's Clothing Store,[site@blueingreensoho.com],https://www.facebook.com/blueingreensoho/,1831,https://www.instagram.com/blueingreensoho,Blue in Green Soho NYC
440,http://www.babybrezza.com/,"486,163",Our Customer Service team is available to assist you Monday through Friday 9am to 10pm EST. http://www.babybrezza.com (1-888-396-6552). Mealtime Made Easy with appliances and accessories that make food and bottle prep quick and easy! ,Baby Goods/Kids Goods,[customerservice@babybrezza.com],https://www.facebook.com/babybrezza/,58539,https://www.instagram.com/babybrezza,Baby Brezza
441,http://www.myuwell.com/,"486,345",The official page for Uwell in the U.S. You can contact us here for any questions or service related issues. Thank you!,Electronics,,https://www.facebook.com/myuwell/,9508,https://www.instagram.com/myuwell,Myuwell
442,,"486,562","¿Qué te parecería un año de Lolys gratis? ¡Consulta las bases y Participa! Ya abrimos en Blvd. Independencia 3883 Plaza España Col. Fresno, Torreon Coah.",Clothing (Brand),,https://www.facebook.com/lolyinthesky/,8350,https://www.instagram.com/lolyinthesky,Distribuidor Loly In The Sky Torreon
443,,"487,203","Arts & Culture Management

* Festivals * Concerts * Talent Management * Workshops * Community Cultural Development",Producer,[laura.lunaza@gmail.com],https://www.facebook.com/LunatiK/,153,https://www.instagram.com/lunatik,Lunatica
444,http://www.uniqueteeshop.com,"487,299","High quality Limited Edition apparel, accessories and collectibles that send a message and show your uniqueness!",Website,[support@uniquetees.zendesk.com],https://www.facebook.com/uniqueteeshop/,3896,https://www.instagram.com/uniqueteeshop,Unique Tee Shop
445,http://www.danielpatricksimmons.com,"487,529",California Designer & Illustrator ,Graphic Designer,[danielpatricksimmons@gmail.com],https://www.facebook.com/danielpatrick/,830,https://www.instagram.com/danielpatrick,Daniel Patrick Simmons
446,http://www.leicastoremiami.com,"487,946", Come visit us in Coral Gables. ,Camera Store,[info@leicastoremiami.com],https://www.facebook.com/LeicaStoreMiami/,19123,https://www.instagram.com/leicastoremiami,Leica Store Miami
447,http://www.hidratespark.com,"488,362",Smart water bottle that tracks your water intake and syncs to an app on your phone. ,Outdoor & Sporting Goods Company,,https://www.facebook.com/hidratespark/,59194,https://www.instagram.com/hidratespark,Hidrate Spark
448,www.campusprotein.com,"488,787",The only one-stop shop for college students who want brand name supplements & vitamins for affordable prices. www.campusprotein.com ,Health & Wellness Website,[info@campusprotein.com],https://www.facebook.com/CampusProtein/,43006,https://www.instagram.com/campusprotein,CampusProtein.com
449,http://apple.co/2ggH5PV,"488,829","Official Brand of the Ball Family.
Built For This
For Apparel, Click on our Website!  
www.bigballerbrand.com",Product/Service,[bigballerbrand@gmail.com],https://www.facebook.com/Bigballerbrand/,107706,https://www.instagram.com/bigballerbrand,Big Baller Brand
450,http://www.youravon.com/kbrobst,"489,070",I'm starting my Avon business back up again!! I love this stuff!! Part nostalgia and part because it is such a great brand!!,Community,,https://www.facebook.com/lovethisstuff/,18,https://www.instagram.com/lovethisstuff,Krystal's Avon page
451,,"489,523","The Craft Shack is run by three generations of one family, offering handmade crafts and cards individually made for you. Always creating something new!",Home Decor,,https://www.facebook.com/CraftShack/,90,https://www.instagram.com/craftshack,The Craft Shack
452,https://onlygrowth.com,"489,712",We help you transform potential into the measurable ROI you need to achieve your goals.,Consulting Agency,[support@onlygrowth.com],https://www.facebook.com/onlygrowth/,635,https://www.instagram.com/onlygrowth,OnlyGrowth
453,http://www.thesmartesthouse.com/,"489,752",The Smartest House is Your Z-wave store. Follow us for deals and news to help you build a perfect smart home!,Retail Company,[info@thesmartesthouse.com],https://www.facebook.com/thesmartesthouse/,260,https://www.instagram.com/thesmartesthouse,The Smartest House
454,https://shockingpresents.com/,"489,853",Shop specializing in impressive gifts and shocking for all audiences at a great price. https://shockingpresents.com/,Product/Service,,https://www.facebook.com/shockingpresents/,1558,https://www.instagram.com/shockingpresents,Shocking Presents
455,http://www.fisherwallace.com/ ,"489,875","The Fisher Wallace Stimulator® treats depression, anxiety and insomnia while boosting focus and concentration.",Product/Service,,https://www.facebook.com/fisherwallace/,31743,https://www.instagram.com/fisherwallace,Fisher Wallace Laboratories
456,http://www.nerdskincare.com,"490,311","Nerd Skincare strives to give you the most effective, holistic, sustainable, and side-effect free skin care essentials.",Beauty Store,,https://www.facebook.com/nerdskincare/,82625,https://www.instagram.com/nerdskincare,NERD Skincare
457,www.SafeandVaultStore.com,"490,403","www.SafeandVaultStore.com offers a large selection of Gun Safes, Burglar Fire Safes, Depository Safes, Wall Safes, Floor Safes and much more!",Website,[info@safeandvaultstore.com],https://www.facebook.com/safeandvaultstore/,6645,https://www.instagram.com/safeandvaultstore,SafeandVaultStore.com
458,https://www.paletteandparlor.com/,"490,620",Timeless modern furniture.,Furniture Store,[studio@paletteandparlor.com],https://www.facebook.com/paletteandparlor/,1162,https://www.instagram.com/paletteandparlor,Palette & Parlor
459,http://www.FFTOB.com/,"490,634","The Original Firefighter Turnout Bags by Niki Rasor recycles retired bunker gear to create unique handbags, duffle bags, backpacks, and more. San Diego, CA",Bags/Luggage,,https://www.facebook.com/firefighterturnoutbag/,200269,https://www.instagram.com/firefighterturnoutbag,Firefighter Turnout Bags
460,http://buildpiper.com,"490,861",A computer kit toolbox for budding engineers! ,Computer Company,[hi@buildpiper.com],https://www.facebook.com/buildpiper/,18133,https://www.instagram.com/buildpiper,Piper
461,http://www.metathreads.gg,"490,929","Meta Threads is a lifestyle gaming brand. We create quality apparel, luggage and accessories with an emphasis on gaming.

Our products are proudly manufactured in the USA at the Meta Threads headquarters located in Los Angeles, California.",Clothing (Brand),[contact@metathreads.com],https://www.facebook.com/metathreads/,2996,https://www.instagram.com/metathreads,Meta Threads
